,created_utc,is_crosspostable,is_self,is_video,locked,media_only,over_18,subreddit_id,subreddit_name_prefixed,subreddit_subscribers,title,permalink,total_awards_received,downs,gilded,num_comments,num_crossposts,num_reports,ups,author_name
0,1427347592.0,True,False,False,False,False,False,t5_2ruq7,r/southpaws,21110,Southpaws only.,/r/southpaws/comments/30cdcx/southpaws_only/,0,0,0,19,0,,379,amici_ursi
1,1358961488.0,True,False,False,False,False,False,t5_2ruq7,r/southpaws,21110,Never had an actual ice cream scooper before and got excited. Oh...wait...,/r/southpaws/comments/174qf2/never_had_an_actual_ice_cream_scooper_before_and/,0,0,0,21,0,,356,Cellar-Door
2,1409449795.0,True,False,False,False,False,False,t5_2ruq7,r/southpaws,21110,Typical.,/r/southpaws/comments/2f1vck/typical/,0,0,0,12,0,,319,pekahead
3,1376397865.0,True,True,False,False,False,False,t5_2ruq7,r/southpaws,21110,Happy Left-handers Day!,/r/southpaws/comments/1k9w0m/happy_lefthanders_day/,0,0,0,23,0,,319,zapfino
4,1357076544.0,True,False,False,False,False,False,t5_2ruq7,r/southpaws,21110,A mug my girlfriend got me. Oh and fuck scissors.,/r/southpaws/comments/15se99/a_mug_my_girlfriend_got_me_oh_and_fuck_scissors/,0,0,0,34,0,,315,alexgough12
5,1597323110.0,True,True,False,False,False,False,t5_2ruq7,r/southpaws,21110,Happy left handers day!,/r/southpaws/comments/i8zch5/happy_left_handers_day/,0,0,0,28,0,,298,carrotnose258
6,1638922677.0,True,False,False,False,False,False,t5_2ruq7,r/southpaws,21110,“Diversity”,/r/southpaws/comments/rbdm1s/diversity/,0,0,0,11,0,,294,Bizchasty
7,1389407041.0,True,False,False,False,False,False,t5_2ruq7,r/southpaws,21110,I FOUND IT!,/r/southpaws/comments/1uxjrs/i_found_it/,0,0,0,22,0,,284,Kolinskyfeet
8,1378329491.0,True,False,False,False,False,False,t5_2ruq7,r/southpaws,21110,Scarlett Johansson (x-post from /r/pics),/r/southpaws/comments/1lqobh/scarlett_johansson_xpost_from_rpics/,0,0,0,20,0,,286,titen
9,1388093390.0,True,False,False,False,False,False,t5_2ruq7,r/southpaws,21110,A little late but here's my favorite Christmas gift I got,/r/southpaws/comments/1trf69/a_little_late_but_heres_my_favorite_christmas/,0,0,0,10,0,,283,
10,1625713269.0,True,True,False,False,False,False,t5_2ruq7,r/southpaws,21110,I’ve always wanted to start a secret society for southpaws. How would you feel if a random stranger slipped you a card inviting you into this club just because you were observed using your left hand?,/r/southpaws/comments/ofyhln/ive_always_wanted_to_start_a_secret_society_for/,1,0,0,64,0,,268,felonious_punk
11,1383847885.0,True,False,False,False,False,False,t5_2ruq7,r/southpaws,21110,The one place where I felt I could be myself :-),/r/southpaws/comments/1q46k9/the_one_place_where_i_felt_i_could_be_myself/,0,0,0,30,0,,267,
12,1344464833.0,True,True,False,False,False,False,t5_2ruq7,r/southpaws,21110,"When I notice an awesome person is a lefty, I get a little excited, does any of get this feeling as well?",/r/southpaws/comments/xwn4k/when_i_notice_an_awesome_person_is_a_lefty_i_get/,0,0,0,59,0,,258,throwmeaway76
13,1439431584.0,True,False,False,False,False,False,t5_2ruq7,r/southpaws,21110,Happy Left Handers' Day!,/r/southpaws/comments/3gsse9/happy_left_handers_day/,0,0,0,42,0,,256,dexter_grissom
14,1387921116.0,True,False,False,False,False,False,t5_2ruq7,r/southpaws,21110,Master Race,/r/southpaws/comments/1tmrzb/master_race/,0,0,0,28,0,,254,not-a-walrus
15,1628831184.0,True,True,False,False,False,False,t5_2ruq7,r/southpaws,21110,Happy left handers day southpaws!,/r/southpaws/comments/p3guol/happy_left_handers_day_southpaws/,0,0,0,27,0,,246,demi12395
16,1391552051.0,True,False,False,False,False,False,t5_2ruq7,r/southpaws,21110,Saw this on the Will Ferrell AMA,/r/southpaws/comments/1x0v0i/saw_this_on_the_will_ferrell_ama/,0,0,0,12,0,,245,Kolinskyfeet
17,1346291806.0,True,False,False,False,False,False,t5_2ruq7,r/southpaws,21110,"I knew Obama was a lefty, but I'm surprised he actually uses a mouse with his left hand.",/r/southpaws/comments/z1yuo/i_knew_obama_was_a_lefty_but_im_surprised_he/,0,0,0,30,0,,239,civilianjones
18,1439499786.0,True,False,False,False,False,False,t5_2ruq7,r/southpaws,21110,Post from r/funny. Thought it fit the day.,/r/southpaws/comments/3gwa1u/post_from_rfunny_thought_it_fit_the_day/,0,0,0,23,0,,228,Jokerang
19,1389368199.0,True,False,False,False,False,True,t5_2ruq7,r/southpaws,21110,Do you see what I see?,/r/southpaws/comments/1uvxdw/do_you_see_what_i_see/,0,0,0,18,0,,219,tunaffect
20,1400208807.0,True,False,False,False,False,False,t5_2ruq7,r/southpaws,21110,"Left handed people DO NOT die 9 years younger. It was a dumb interpretation from a bad study, and here's a BBC look into why this is not true. Spread this far and wide, my left-handed brethren",/r/southpaws/comments/25okty/left_handed_people_do_not_die_9_years_younger_it/,0,0,0,10,0,,213,YouTee
21,1471105488.0,True,True,False,False,False,False,t5_2ruq7,r/southpaws,21110,Happy lefty day :),/r/southpaws/comments/4xjra7/happy_lefty_day/,0,0,0,20,0,,210,NJS331
22,1369085873.0,True,False,False,False,False,False,t5_2ruq7,r/southpaws,21110,Target got new card readers with the pen on the correct side!,/r/southpaws/comments/1epymt/target_got_new_card_readers_with_the_pen_on_the/,0,0,0,13,0,,207,trek_nerd
23,1388622761.0,True,False,False,False,False,False,t5_2ruq7,r/southpaws,21110,Was watching Tangled for the New Year and noticed this brave hero's hand preference.,/r/southpaws/comments/1u6xus/was_watching_tangled_for_the_new_year_and_noticed/,0,0,0,16,0,,201,ithinkmynameismoose
24,1367369691.0,True,False,False,False,False,False,t5_2ruq7,r/southpaws,21110,"After 31 long years, a new lefty in the family! Eats, bats, throws, kicks lefty. =)",/r/southpaws/comments/1dg8f4/after_31_long_years_a_new_lefty_in_the_family/,0,0,0,11,0,,199,djsanchez2
25,1417201431.0,True,False,False,False,False,False,t5_2ruq7,r/southpaws,21110,Hand Turkeys,/r/southpaws/comments/2not1x/hand_turkeys/,0,0,0,4,0,,198,shadowfiles
26,1400567308.0,True,False,False,False,False,False,t5_2ruq7,r/southpaws,21110,One of the reasons I don't use pencils.,/r/southpaws/comments/260e73/one_of_the_reasons_i_dont_use_pencils/,0,0,0,31,0,,195,SeaShanties
27,1399253241.0,True,False,False,False,False,False,t5_2ruq7,r/southpaws,21110,Just yet another leftie problem,/r/southpaws/comments/24qm2p/just_yet_another_leftie_problem/,0,0,0,14,0,,194,ForestCrunch
28,1318271858.0,True,False,False,False,False,False,t5_2ruq7,r/southpaws,21110,The 9% (x-post from r/funny),/r/southpaws/comments/l7c1d/the_9_xpost_from_rfunny/,0,0,0,3,0,,188,Avertr
29,1326488059.0,True,True,False,False,False,False,t5_2ruq7,r/southpaws,21110,"""That's not a REAL issue!""",/r/southpaws/comments/ofx0h/thats_not_a_real_issue/,0,0,0,27,0,,181,ComebackShane
30,1307157939.0,True,True,False,False,False,False,t5_2ruq7,r/southpaws,21110,Two lefties meeting = INSTANT CONNECTION,/r/southpaws/comments/hr9ts/two_lefties_meeting_instant_connection/,1,0,0,16,0,,180,sirobin
31,1370629617.0,True,False,False,False,False,False,t5_2ruq7,r/southpaws,21110,"TIL Jay-Z, 50 Cent, Tupac, Dr Dre and Eminem are left handed",/r/southpaws/comments/1fvlvt/til_jayz_50_cent_tupac_dr_dre_and_eminem_are_left/,0,0,0,16,0,,181,kuyakew
32,1359334868.0,True,False,False,False,False,False,t5_2ruq7,r/southpaws,21110,should i let her know how we feel about this?,/r/southpaws/comments/17edoa/should_i_let_her_know_how_we_feel_about_this/,0,0,0,15,0,,179,masterpanda253
33,1534191571.0,True,True,False,False,False,False,t5_2ruq7,r/southpaws,21110,It's Left Handers Day: Time to rise up fellow left handers and take what's leftfully ours.,/r/southpaws/comments/971s32/its_left_handers_day_time_to_rise_up_fellow_left/,0,0,0,14,0,,177,WoozleWuzzle
34,1424005397.0,True,False,False,False,False,False,t5_2ruq7,r/southpaws,21110,Blatant discrimination at Hobbycraft,/r/southpaws/comments/2vyuho/blatant_discrimination_at_hobbycraft/,0,0,0,20,0,,179,
35,1635790065.0,True,False,False,False,False,False,t5_2ruq7,r/southpaws,21110,This is my handwriting. The last three sentences don't look the best tho.,/r/southpaws/comments/qkjwak/this_is_my_handwriting_the_last_three_sentences/,1,0,0,19,0,,174,faraz224
36,1407945348.0,True,False,False,False,False,False,t5_2ruq7,r/southpaws,21110,"Happy Left Hander's Day! Fuck spiral notebooks, these things are the best",/r/southpaws/comments/2dg3cu/happy_left_handers_day_fuck_spiral_notebooks/,0,0,0,25,0,,174,ThreeTwo111
37,1600142572.0,True,True,False,False,False,False,t5_2ruq7,r/southpaws,21110,Who tries to make sure they sit in a “left handed” chair when they are eating with a group,/r/southpaws/comments/it1bqq/who_tries_to_make_sure_they_sit_in_a_left_handed/,0,0,0,30,0,,172,1whiteguy
38,1391534830.0,True,False,False,False,False,False,t5_2ruq7,r/southpaws,21110,"Aw, we have Martin Freeman!",/r/southpaws/comments/1x00cl/aw_we_have_martin_freeman/,0,0,0,12,0,,175,kdanger
39,1343314104.0,True,False,False,False,False,False,t5_2ruq7,r/southpaws,21110,Best fencer in the world is a lefty,/r/southpaws/comments/x6wfr/best_fencer_in_the_world_is_a_lefty/,0,0,0,12,0,,173,robotreader
40,1581296929.0,True,True,False,False,False,False,t5_2ruq7,r/southpaws,21110,A quick shout out to all the mothers and grandmothers who made sure we lefties got to sit at the end of the table so we wouldn't rub elbows with righties while we ate.,/r/southpaws/comments/f1ijgv/a_quick_shout_out_to_all_the_mothers_and/,0,0,0,14,0,,171,FaberGrad
41,1508980992.0,True,True,False,False,False,False,t5_2ruq7,r/southpaws,21110,"I've been on reddit 6 years and literally, just now, thought... ""There's got to be a Lefty sub!?"" Hello, my brethren!",/r/southpaws/comments/78sban/ive_been_on_reddit_6_years_and_literally_just_now/,1,0,1,11,0,,172,sparks277
42,1378178272.0,True,False,False,False,False,False,t5_2ruq7,r/southpaws,21110,If we're posting about lefties in games...,/r/southpaws/comments/1lmd1o/if_were_posting_about_lefties_in_games/,0,0,0,35,0,,172,durandal419
43,1440351472.0,True,False,False,False,False,False,t5_2ruq7,r/southpaws,21110,All you lefties will appreciate this,/r/southpaws/comments/3i3lp1/all_you_lefties_will_appreciate_this/,0,0,0,17,0,,164,chickiej75
44,1366529151.0,True,False,False,False,False,False,t5_2ruq7,r/southpaws,21110,A nice setting on the Galaxy Note 2,/r/southpaws/comments/1csg3q/a_nice_setting_on_the_galaxy_note_2/,0,0,0,9,0,,162,thetoethumb
45,1534147070.0,True,True,False,False,False,False,t5_2ruq7,r/southpaws,21110,Today is International Left Handers Day.,/r/southpaws/comments/96wgfg/today_is_international_left_handers_day/,0,0,0,17,0,,157,DraftSaturn15
46,1402251761.0,True,False,False,False,False,False,t5_2ruq7,r/southpaws,21110,The Leader of the Free World,/r/southpaws/comments/27mtos/the_leader_of_the_free_world/,0,0,0,22,0,,160,kemmer
47,1386745109.0,True,False,False,False,False,False,t5_2ruq7,r/southpaws,21110,"As a lefty, my day was made when I discovered these exist",/r/southpaws/comments/1smaer/as_a_lefty_my_day_was_made_when_i_discovered/,0,0,0,36,0,,165,Desolets
48,1422921194.0,True,True,False,False,False,False,t5_2ruq7,r/southpaws,21110,"""Average"" is the most satisfying word to type. Go ahead, try it out.",/r/southpaws/comments/2ukqwt/average_is_the_most_satisfying_word_to_type_go/,0,0,0,49,0,,163,Socra_tease
49,1384872424.0,True,False,False,False,False,False,t5_2ruq7,r/southpaws,21110,A pen for us.,/r/southpaws/comments/1qz8gn/a_pen_for_us/,0,0,0,26,0,,158,mosqua
50,1642194719.0,True,False,False,False,False,False,t5_2ruq7,r/southpaws,21110,"I’ve seen a lot of misconceptions, but this is a new one for me.",/r/southpaws/comments/s42qs5/ive_seen_a_lot_of_misconceptions_but_this_is_a/,0,0,0,13,0,,156,ThePinkTeenager
51,1639308182.0,True,False,False,False,False,False,t5_2ruq7,r/southpaws,21110,Finally finished my project. An open-source gaming keypad for lefties!,/r/southpaws/comments/ren489/finally_finished_my_project_an_opensource_gaming/,0,0,0,10,0,,155,Kyek
52,1586710609.0,True,True,False,False,False,False,t5_2ruq7,r/southpaws,21110,It surprises me how oblivious people are to the left hand,/r/southpaws/comments/g00ai2/it_surprises_me_how_oblivious_people_are_to_the/,0,0,0,48,0,,155,xmattack
53,1402098944.0,True,False,False,False,False,False,t5_2ruq7,r/southpaws,21110,Was just at the shooting range with a friend. This price difference is discriminatory!,/r/southpaws/comments/27ih77/was_just_at_the_shooting_range_with_a_friend_this/,0,0,0,20,0,,154,Branfron
54,1367672694.0,True,False,False,False,False,False,t5_2ruq7,r/southpaws,21110,Writing in pen,/r/southpaws/comments/1docom/writing_in_pen/,0,0,0,20,0,,156,You_coward
55,1377643289.0,True,False,False,False,False,False,t5_2ruq7,r/southpaws,21110,Not designed for lefties [X-post from r/gifs],/r/southpaws/comments/1l7xkb/not_designed_for_lefties_xpost_from_rgifs/,0,0,0,15,0,,156,xanderbeezy
56,1404316851.0,True,False,False,False,False,False,t5_2ruq7,r/southpaws,21110,Day-to-day Life for Left-handers.,/r/southpaws/comments/29nqdg/daytoday_life_for_lefthanders/,0,0,0,10,0,,153,masterpigg
57,1516666508.0,True,True,False,False,False,False,t5_2ruq7,r/southpaws,21110,The most annoying thing by far about a leftie is having the binder rings block your hand while writing.,/r/southpaws/comments/7saco0/the_most_annoying_thing_by_far_about_a_leftie_is/,0,0,0,38,0,,151,
58,1348668382.0,True,False,False,False,False,False,t5_2ruq7,r/southpaws,21110,"As a left hander, this anti-harassment ad hurt me right in the feels [x-post  from r/videos]",/r/southpaws/comments/10i8w6/as_a_left_hander_this_antiharassment_ad_hurt_me/,0,0,0,46,0,,152,isdonisgood
59,1615914284.0,True,True,False,False,False,False,t5_2ruq7,r/southpaws,21110,"Reminder: If you're getting the COVID-19 vaccine, consider asking it to be administered in your right arm!",/r/southpaws/comments/m6duoa/reminder_if_youre_getting_the_covid19_vaccine/,0,0,0,47,0,,148,arickp
60,1492105093.0,True,True,False,False,False,False,t5_2ruq7,r/southpaws,21110,Does anyone else take pride in the fact that you can use a right handed mouse and write down notes at the same time?,/r/southpaws/comments/656zw9/does_anyone_else_take_pride_in_the_fact_that_you/,0,0,0,31,0,,149,jewdai
61,1407272010.0,True,False,False,False,False,False,t5_2ruq7,r/southpaws,21110,Left in a Right World - Infographic [x-post from r/InterestingAsFuck],/r/southpaws/comments/2cq2ij/left_in_a_right_world_infographic_xpost_from/,0,0,0,36,0,,150,treesdown
62,1344834468.0,True,True,False,False,False,False,t5_2ruq7,r/southpaws,21110,Happy International Lefthanders Day!,/r/southpaws/comments/y4osg/happy_international_lefthanders_day/,0,0,0,16,0,,148,ouchjars
63,1502566521.0,True,True,False,False,False,False,t5_2ruq7,r/southpaws,21110,August 13th is Left handers day!,/r/southpaws/comments/6tagln/august_13th_is_left_handers_day/,0,0,0,26,0,,148,
64,1357454032.0,True,False,False,False,False,False,t5_2ruq7,r/southpaws,21110,"like other subreddits, we need a picture on the left side of the screen for ours I suggest this.",/r/southpaws/comments/161t8s/like_other_subreddits_we_need_a_picture_on_the/,0,0,0,16,0,,144,fptp01
65,1394761195.0,True,False,False,False,False,False,t5_2ruq7,r/southpaws,21110,My mom got me this a few years ago.,/r/southpaws/comments/20da63/my_mom_got_me_this_a_few_years_ago/,0,0,0,14,0,,147,mjb_22
66,1616009860.0,True,True,False,False,False,False,t5_2ruq7,r/southpaws,21110,A Left-Handed Cheat,/r/southpaws/comments/m78nz5/a_lefthanded_cheat/,0,0,0,13,0,,147,littlespawningflower
67,1326445059.0,True,False,False,False,False,False,t5_2ruq7,r/southpaws,21110,"Congratulations r/Southpaws! You are the Subreddit of the Day for January 13, 2012.  ",/r/southpaws/comments/of9c3/congratulations_rsouthpaws_you_are_the_subreddit/,0,0,0,10,0,,146,rileyxradio
68,1599202741.0,True,True,False,False,False,False,t5_2ruq7,r/southpaws,21110,I just realized the Lo-Fi Hip-hop Girl is left handed.,/r/southpaws/comments/imbb3m/i_just_realized_the_lofi_hiphop_girl_is_left/,0,0,0,6,0,,143,hypermarv123
69,1395849610.0,True,False,False,False,False,False,t5_2ruq7,r/southpaws,21110,Ned Flanders Lego minifigure will be available in May. Check out his mug.,/r/southpaws/comments/21f8b7/ned_flanders_lego_minifigure_will_be_available_in/,0,0,0,10,0,,145,zapfino
70,1385158973.0,True,False,False,False,False,False,t5_2ruq7,r/southpaws,21110,I figured out why my pastry fork wasn't helping.,/r/southpaws/comments/1r8y2c/i_figured_out_why_my_pastry_fork_wasnt_helping/,0,0,0,14,0,,140,sun_spotting
71,1598653582.0,True,True,False,False,False,False,t5_2ruq7,r/southpaws,21110,Ball Point Pens Can Burn in Hell,/r/southpaws/comments/iigzad/ball_point_pens_can_burn_in_hell/,0,0,0,39,0,,143,Cyyykosis
72,1413028344.0,True,False,False,False,False,False,t5_2ruq7,r/southpaws,21110,Cars: now even LESS friendly to us lefties.,/r/southpaws/comments/2ixtji/cars_now_even_less_friendly_to_us_lefties/,0,0,0,54,0,,139,a1tb1t
73,1372074230.0,True,False,False,False,False,False,t5_2ruq7,r/southpaws,21110,Here's something I never realized was right-handed until a friend gave me this... so simple but so helpful.,/r/southpaws/comments/1gyov2/heres_something_i_never_realized_was_righthanded/,0,0,0,16,0,,141,Ssouthpaw
74,1441557049.0,True,False,False,False,False,False,t5_2ruq7,r/southpaws,21110,What people tell me when they see I'm left-handed,/r/southpaws/comments/3jvc4p/what_people_tell_me_when_they_see_im_lefthanded/,0,0,0,50,0,,139,TheBobolo
75,1402453301.0,True,False,False,False,False,False,t5_2ruq7,r/southpaws,21110,Left-Handed Problems,/r/southpaws/comments/27uczi/lefthanded_problems/,0,0,0,24,0,,140,BillTheKill
76,1430025268.0,True,False,False,False,False,False,t5_2ruq7,r/southpaws,21110,Twist open pens are useless to lefties,/r/southpaws/comments/33w6b6/twist_open_pens_are_useless_to_lefties/,0,0,0,33,0,,142,albertsy2
77,1374998909.0,True,False,False,False,False,False,t5_2ruq7,r/southpaws,21110,"Not exactly unusable, but notice the text orientation. Its the little things we notice sometimes",/r/southpaws/comments/1j7guz/not_exactly_unusable_but_notice_the_text/,0,0,0,27,0,,136,The6thHorcrux
78,1376424228.0,True,False,False,False,False,False,t5_2ruq7,r/southpaws,21110,Finally found an ink pen that recognizes our struggle.,/r/southpaws/comments/1kathb/finally_found_an_ink_pen_that_recognizes_our/,0,0,0,12,0,,139,Ames929
79,1390822071.0,True,False,False,False,False,False,t5_2ruq7,r/southpaws,21110,Anna from Frozen has beautiful throwing form!,/r/southpaws/comments/1w9tdg/anna_from_frozen_has_beautiful_throwing_form/,0,0,0,2,0,,139,ithinkmynameismoose
80,1347438336.0,True,True,False,False,False,False,t5_2ruq7,r/southpaws,21110,"When I was young, my mum did not want me to be a leftie so she told my teacher to hit me every time I used my left hand to write.",/r/southpaws/comments/zr9zu/when_i_was_young_my_mum_did_not_want_me_to_be_a/,0,0,0,72,0,,133,raichu_alovesong
81,1593389393.0,True,True,False,False,False,False,t5_2ruq7,r/southpaws,21110,Bought a set of left handed items,/r/southpaws/comments/hhpiey/bought_a_set_of_left_handed_items/,1,0,0,34,0,,134,AngryBreadRevolution
82,1417514789.0,True,False,False,False,False,False,t5_2ruq7,r/southpaws,21110,I'm so glad I finally found my fellow paws'! The struggle is real [x-post /r/pics),/r/southpaws/comments/2o18ie/im_so_glad_i_finally_found_my_fellow_paws_the/,0,0,0,4,0,,132,
83,1567720508.0,True,True,False,False,False,False,t5_2ruq7,r/southpaws,21110,Left-handed DNA found - and it changes brain structure,/r/southpaws/comments/d07gzm/lefthanded_dna_found_and_it_changes_brain/,0,0,0,17,0,,132,Punch-Counterpunch
84,1388704485.0,True,False,False,False,False,False,t5_2ruq7,r/southpaws,21110,Scrubs fans should know; We have The Todd,/r/southpaws/comments/1u9mku/scrubs_fans_should_know_we_have_the_todd/,0,0,0,9,0,,132,ithinkmynameismoose
85,1409039716.0,True,False,False,False,False,False,t5_2ruq7,r/southpaws,21110,The one in a million chair we all looked for in school. (xpost r/pics),/r/southpaws/comments/2elxz9/the_one_in_a_million_chair_we_all_looked_for_in/,0,0,0,15,0,,132,raknor88
86,1394196918.0,True,False,False,False,False,False,t5_2ruq7,r/southpaws,21110,Tools of the oppressors!,/r/southpaws/comments/1zszz4/tools_of_the_oppressors/,0,0,0,23,0,,131,NyQuil012
87,1345499523.0,True,False,False,False,False,False,t5_2ruq7,r/southpaws,21110,"Thousands of years ago, humans have left hand prints in these caves. About 8% were left handed.",/r/southpaws/comments/yjnnf/thousands_of_years_ago_humans_have_left_hand/,0,0,0,9,0,,132,elperroborrachotoo
88,1338068079.0,True,False,False,False,False,False,t5_2ruq7,r/southpaws,21110,Just re-watched the Avengers. I can't be the only one who picked up on the southpaw of the group.,/r/southpaws/comments/u6glt/just_rewatched_the_avengers_i_cant_be_the_only/,0,0,0,27,0,,128,pinklikepinkman
89,1431986570.0,True,False,False,False,False,False,t5_2ruq7,r/southpaws,21110,Jerry from the cartoon Tom And Jerry is left-handed.,/r/southpaws/comments/36f32o/jerry_from_the_cartoon_tom_and_jerry_is_lefthanded/,0,0,0,6,0,,127,mayxlyn
90,1349879057.0,True,False,False,False,False,False,t5_2ruq7,r/southpaws,21110,Even playing cards don't play fair. :(,/r/southpaws/comments/1193p0/even_playing_cards_dont_play_fair/,0,0,0,17,0,,125,neohylanmay
91,1387222022.0,True,True,False,False,False,False,t5_2ruq7,r/southpaws,21110,Do any other lefties find it attractive when someone of the opposite sex is left handed?,/r/southpaws/comments/1t0zje/do_any_other_lefties_find_it_attractive_when/,0,0,0,71,0,,126,
92,1372204681.0,True,False,False,False,False,False,t5_2ruq7,r/southpaws,21110,Judy Garland (Dorothy) was a lefty!,/r/southpaws/comments/1h2nre/judy_garland_dorothy_was_a_lefty/,0,0,0,1,0,,123,classic_stars
93,1367983783.0,True,True,False,False,False,False,t5_2ruq7,r/southpaws,21110,How I found out I was a lefty.,/r/southpaws/comments/1dws73/how_i_found_out_i_was_a_lefty/,0,0,0,28,0,,127,bacchus8408
94,1396581232.0,True,False,False,False,False,False,t5_2ruq7,r/southpaws,21110,"Left Handed People Have Better Sex, Are More Satisfied: Study",/r/southpaws/comments/225uhk/left_handed_people_have_better_sex_are_more/,0,0,0,19,0,,128,N3PHxx
95,1602802356.0,True,True,False,False,False,False,t5_2ruq7,r/southpaws,21110,How many of you fellow lefties can use right-handed scissors with your right hand?,/r/southpaws/comments/jby67c/how_many_of_you_fellow_lefties_can_use/,0,0,0,64,0,,126,kepler800
96,1510936825.0,True,True,False,False,False,False,t5_2ruq7,r/southpaws,21110,Righties don't understand lefty's infatuation with other lefties.,/r/southpaws/comments/7dm74r/righties_dont_understand_leftys_infatuation_with/,1,0,1,15,0,,125,Arthurlurk1
97,1578968048.0,True,True,False,False,False,False,t5_2ruq7,r/southpaws,21110,Getting a little quiet in here so a quick story,/r/southpaws/comments/eoel05/getting_a_little_quiet_in_here_so_a_quick_story/,0,0,0,35,0,,124,Jeffde
98,1408400568.0,True,False,False,False,False,False,t5_2ruq7,r/southpaws,21110,seinfeld and costanza BOTH!,/r/southpaws/comments/2dxdc4/seinfeld_and_costanza_both/,0,0,0,5,0,,119,vurke
99,1376354219.0,True,False,False,False,False,False,t5_2ruq7,r/southpaws,21110,A store just for us! [FIXED],/r/southpaws/comments/1k8u0j/a_store_just_for_us_fixed/,0,0,0,7,0,,120,JayGatsbyyy
100,1330318297.0,True,True,False,False,False,False,t5_2ruq7,r/southpaws,21110,How many of you have problem with Ink or Pencil markings on your hand when writing?,/r/southpaws/comments/q7oxb/how_many_of_you_have_problem_with_ink_or_pencil/,0,0,0,55,0,,121,fptp01
101,1594588861.0,True,True,False,False,False,False,t5_2ruq7,r/southpaws,21110,For any lefty musicians who live in NYC...,/r/southpaws/comments/hq2blr/for_any_lefty_musicians_who_live_in_nyc/,0,0,0,14,0,,121,ParaShift77
102,1454401690.0,True,False,False,False,False,False,t5_2ruq7,r/southpaws,21110,All you left-handers out there (ftw!) remember to stop by! We're open!,/r/southpaws/comments/43tdit/all_you_lefthanders_out_there_ftw_remember_to/,0,0,0,5,0,,120,
103,1440616481.0,True,False,False,False,False,False,t5_2ruq7,r/southpaws,21110,I've never seen one of these before. It's beautiful,/r/southpaws/comments/3ii3l3/ive_never_seen_one_of_these_before_its_beautiful/,0,0,0,6,0,,121,BooniSmells
104,1434166178.0,True,False,False,False,False,False,t5_2ruq7,r/southpaws,21110,Bought these at Goodwill for $1. I've only used right-handed scissors since grade school. So awkward to use these.,/r/southpaws/comments/39o1ed/bought_these_at_goodwill_for_1_ive_only_used/,0,0,0,19,0,,121,marko719
105,1645583959.0,True,False,False,False,False,False,t5_2ruq7,r/southpaws,21110,We lefties know the truth.,/r/southpaws/comments/sz5y8z/we_lefties_know_the_truth/,0,0,0,7,0,,117,wimpykidfan37
106,1421941915.0,True,False,False,False,False,False,t5_2ruq7,r/southpaws,21110,I found a left handed desk in class.,/r/southpaws/comments/2tapkh/i_found_a_left_handed_desk_in_class/,0,0,0,27,0,,115,bigpandamonium
107,1404081093.0,True,True,False,False,False,False,t5_2ruq7,r/southpaws,21110,Fuck whiteboards,/r/southpaws/comments/29fbtf/fuck_whiteboards/,0,0,0,26,0,,117,RunawayPen
108,1403148511.0,True,False,False,False,False,False,t5_2ruq7,r/southpaws,21110,Found this store in San Francisco,/r/southpaws/comments/28irsr/found_this_store_in_san_francisco/,0,0,0,9,0,,115,nyaatalie
109,1375129971.0,True,False,False,False,False,False,t5_2ruq7,r/southpaws,21110,Don't know if this has been posted before but I thought my southpaws would like this.,/r/southpaws/comments/1jatt7/dont_know_if_this_has_been_posted_before_but_i/,0,0,0,12,0,,116,dine_gal
