,created_utc,is_crosspostable,is_self,is_video,locked,media_only,over_18,subreddit_id,subreddit_name_prefixed,subreddit_subscribers,title,permalink,total_awards_received,downs,gilded,num_comments,num_crossposts,num_reports,ups,author_name
655,1336487662.0,True,True,False,False,False,False,t5_2ruq7,r/southpaws,21110,"Left handed, right eye dominant.",/r/southpaws/comments/tcyth/left_handed_right_eye_dominant/,0,0,0,50,0,,36,The-Deliverator
656,1299652367.0,True,False,False,False,False,False,t5_2ruq7,r/southpaws,21110,I was watching the third season of Dexter and I noticed he golfs lefty,/r/southpaws/comments/g0ag1/i_was_watching_the_third_season_of_dexter_and_i/,0,0,0,4,0,,34,crazedover
657,1299031177.0,True,True,False,False,False,False,t5_2ruq7,r/southpaws,21110,Does any other lefty face the problem of inconsistent penmanship/handwriting?,/r/southpaws/comments/fvh4g/does_any_other_lefty_face_the_problem_of/,0,0,0,32,0,,36,mrechan00
658,1648327946.0,True,True,False,False,False,False,t5_2ruq7,r/southpaws,21110,"Request: Left-handed kitchen/utility scissors that can cut plastic bags, etc. more than once",/r/southpaws/comments/tp3utx/request_lefthanded_kitchenutility_scissors_that/,0,0,0,19,0,,34,breachofcontract
659,1647133254.0,True,True,False,False,False,False,t5_2ruq7,r/southpaws,21110,Fellow lefties. How dominant is your left hand truly?,/r/southpaws/comments/tcveti/fellow_lefties_how_dominant_is_your_left_hand/,0,0,0,57,0,,37,WaterLTE
660,1628888222.0,True,True,False,False,False,False,t5_2ruq7,r/southpaws,21110,Why does writing define handedness?,/r/southpaws/comments/p3tzvu/why_does_writing_define_handedness/,0,0,0,16,0,,33,It_is_not_me
661,1616287849.0,True,True,False,False,False,False,t5_2ruq7,r/southpaws,21110,Chopsticks,/r/southpaws/comments/m9kiqk/chopsticks/,0,0,0,36,0,,34,Summerized
662,1615484024.0,True,True,False,False,False,False,t5_2ruq7,r/southpaws,21110,"I'm a righty, but I was reading comments by people forced to switch and some things rang true.",/r/southpaws/comments/m2vrqy/im_a_righty_but_i_was_reading_comments_by_people/,1,0,0,27,0,,31,Kelekona
663,1610029143.0,True,True,False,False,False,False,t5_2ruq7,r/southpaws,21110,"Back when left-handedness was considered bad, was it only teachers/parents who had a problem with it or did your peers/classmates also have a problem with southpaws?",/r/southpaws/comments/kse56s/back_when_lefthandedness_was_considered_bad_was/,0,0,0,29,0,,36,throwawaysouthpaw
664,1576794565.0,True,True,False,False,False,False,t5_2ruq7,r/southpaws,21110,Being forced to write in pen on essays help,/r/southpaws/comments/ed0m66/being_forced_to_write_in_pen_on_essays_help/,0,0,0,41,0,,32,
665,1574271128.0,True,True,False,False,False,False,t5_2ruq7,r/southpaws,21110,When you are trying to move out of the way from someone walking in your direction...,/r/southpaws/comments/dz5a4j/when_you_are_trying_to_move_out_of_the_way_from/,0,0,0,13,0,,34,ToonlinkFTW890
666,1568921234.0,True,True,False,False,False,False,t5_2ruq7,r/southpaws,21110,"Forced righties, how did you find out that you are naturally a lefty?",/r/southpaws/comments/d6iz0l/forced_righties_how_did_you_find_out_that_you_are/,0,0,0,13,0,,34,ToonlinkFTW890
667,1533665536.0,True,True,False,False,False,False,t5_2ruq7,r/southpaws,21110,Helping my leftie son,/r/southpaws/comments/95e2kt/helping_my_leftie_son/,0,0,0,76,0,,35,unluckypig
668,1526185159.0,True,True,False,False,False,False,t5_2ruq7,r/southpaws,21110,Writing instruments that aren't a pencil. What's everyone using?,/r/southpaws/comments/8j1ixp/writing_instruments_that_arent_a_pencil_whats/,0,0,0,47,0,,35,fatalifeaten
669,1511111053.0,True,True,False,False,False,False,t5_2ruq7,r/southpaws,21110,Bumping elbows?,/r/southpaws/comments/7e1t05/bumping_elbows/,1,0,1,25,0,,31,
670,1451687290.0,True,False,False,False,False,False,t5_2ruq7,r/southpaws,21110,"Of course, there’s only one possible use for the snoovatar feature (x-post /r/snoovatars)",/r/southpaws/comments/3z2dzo/of_course_theres_only_one_possible_use_for_the/,0,0,0,1,0,,34,
671,1446693514.0,True,False,False,False,False,False,t5_2ruq7,r/southpaws,21110,Which one of this is closer to your handwriting style?,/r/southpaws/comments/3rkzbj/which_one_of_this_is_closer_to_your_handwriting/,0,0,0,59,0,,36,MacASM
672,1440512458.0,True,True,False,False,False,False,t5_2ruq7,r/southpaws,21110,My classroom put the leftie desks against the left wall.,/r/southpaws/comments/3ic43j/my_classroom_put_the_leftie_desks_against_the/,0,0,0,29,0,,33,LurkingMenno
673,1416294224.0,True,True,False,False,False,False,t5_2ruq7,r/southpaws,21110,Anyone else find it easier to befriend and bond with fellow lefties?,/r/southpaws/comments/2mn7tv/anyone_else_find_it_easier_to_befriend_and_bond/,0,0,0,15,0,,35,Southpaw217
674,1391642564.0,True,False,False,False,False,False,t5_2ruq7,r/southpaws,21110,10 Beautiful lefties,/r/southpaws/comments/1x4mut/10_beautiful_lefties/,0,0,0,5,0,,30,madcowga
675,1376849947.0,True,False,False,False,False,False,t5_2ruq7,r/southpaws,21110,Food for thought: The Left-Brain-Right-Brain Distinction is as Fake as it Always Sounded,/r/southpaws/comments/1km7c3/food_for_thought_the_leftbrainrightbrain/,0,0,0,8,0,,34,gmcg_abidesII
676,1373345100.0,True,True,False,False,False,False,t5_2ruq7,r/southpaws,21110,"Anyone else feel like having to use certain items the ""wrong"" way (right handed for us) is an advantage?",/r/southpaws/comments/1hwzbw/anyone_else_feel_like_having_to_use_certain_items/,0,0,0,27,0,,37,
677,1346140430.0,True,True,False,False,False,False,t5_2ruq7,r/southpaws,21110,left handed reddit app!,/r/southpaws/comments/yya43/left_handed_reddit_app/,0,0,0,9,0,,30,brighterthansunshine
678,1642685230.0,True,True,False,False,False,False,t5_2ruq7,r/southpaws,21110,Study on Handedness and Word valance is now CLOSED. Many thanks to all who participated and commented. I appreciate you all. Your help will allow for further findings in research in relation to differences between lefthanded and righthanded people in ways of subconcious processing. Thank you. :),/r/southpaws/comments/s8iz9f/study_on_handedness_and_word_valance_is_now/,0,0,0,7,0,,33,catdogratlefthander
679,1626334530.0,True,True,False,False,False,False,t5_2ruq7,r/southpaws,21110,"Left-handed mom and dad, right handed kids",/r/southpaws/comments/oknxne/lefthanded_mom_and_dad_right_handed_kids/,1,0,0,29,0,,34,Chasqvi1
680,1584992721.0,True,True,False,False,False,False,t5_2ruq7,r/southpaws,21110,Forced Left-Handedness?,/r/southpaws/comments/fnqi9y/forced_lefthandedness/,0,0,0,16,0,,32,faustcliffe
681,1572893532.0,True,True,False,False,False,False,t5_2ruq7,r/southpaws,21110,Left-Handed daughter seems to read backwards?,/r/southpaws/comments/drm572/lefthanded_daughter_seems_to_read_backwards/,0,0,0,15,0,,32,DarthFisticuffs
682,1506997329.0,True,True,False,False,False,False,t5_2ruq7,r/southpaws,21110,Mark Wahlberg is a fellow left hander... But so much more,/r/southpaws/comments/73xk49/mark_wahlberg_is_a_fellow_left_hander_but_so_much/,0,0,0,7,0,,34,stupidiot00
683,1494962621.0,True,True,False,False,False,False,t5_2ruq7,r/southpaws,21110,Was anybody else told they write weird?,/r/southpaws/comments/6bjmok/was_anybody_else_told_they_write_weird/,0,0,0,17,0,,32,FatParCheesy
684,1477214440.0,True,True,False,False,False,False,t5_2ruq7,r/southpaws,21110,Do we have a left handed kindle option yet?,/r/southpaws/comments/58xur6/do_we_have_a_left_handed_kindle_option_yet/,0,0,0,14,0,,32,skellious
685,1458541022.0,True,True,False,False,False,False,t5_2ruq7,r/southpaws,21110,Just an FYI to any lefty guitar players out there,/r/southpaws/comments/4bb79l/just_an_fyi_to_any_lefty_guitar_players_out_there/,0,0,0,27,0,,32,IamManuelLaBor
686,1447949585.0,True,False,False,False,False,False,t5_2ruq7,r/southpaws,21110,Why are some people are left-handed? - Daniel M. Abrams,/r/southpaws/comments/3tg480/why_are_some_people_are_lefthanded_daniel_m_abrams/,0,0,0,3,0,,32,8daysuntiltheweekend
687,1446643603.0,True,False,False,False,False,False,t5_2ruq7,r/southpaws,21110,CNN article on the advantages and disadvantages of being left handed,/r/southpaws/comments/3rhmxw/cnn_article_on_the_advantages_and_disadvantages/,0,0,0,7,0,,34,frogger3344
688,1446438736.0,True,True,False,False,False,False,t5_2ruq7,r/southpaws,21110,Don't buy a Uniball Vision Elite pen,/r/southpaws/comments/3r6848/dont_buy_a_uniball_vision_elite_pen/,0,0,0,24,0,,35,ZGraves
689,1446340080.0,True,False,False,False,False,False,t5_2ruq7,r/southpaws,21110,"A little research lead me to find that there have been 0 left handed catchers to have caught more than 1,000 games in the major leagues since 1900",/r/southpaws/comments/3r178e/a_little_research_lead_me_to_find_that_there_have/,0,0,0,9,0,,34,mrking944
690,1445809366.0,True,True,False,False,False,False,t5_2ruq7,r/southpaws,21110,"Do you consider people who ONLY write with their left hand ""lefties""?",/r/southpaws/comments/3q75md/do_you_consider_people_who_only_write_with_their/,0,0,0,49,0,,33,eMikey
691,1420571342.0,True,True,False,False,False,False,t5_2ruq7,r/southpaws,21110,"How different do you think the world would be if left handers, rather than right handers, were the vast majority? Or if the ratio were close to 50/50?",/r/southpaws/comments/2rji71/how_different_do_you_think_the_world_would_be_if/,0,0,0,17,0,,29,JoeCool888
692,1414061610.0,True,True,False,False,False,False,t5_2ruq7,r/southpaws,21110,"Married lefties, did wearing a ring on your dominant hand annoy you?",/r/southpaws/comments/2k32rq/married_lefties_did_wearing_a_ring_on_your/,0,0,0,37,0,,31,goldielox13
693,1339313391.0,True,True,False,False,False,False,t5_2ruq7,r/southpaws,21110,"Fellow southpaws, what is the reasoning behind the ""lefty way"" and the ""righty way"" to hold utensils such as golf clubs and baseball bats? Because to me, it makes NO sense. ",/r/southpaws/comments/uucs3/fellow_southpaws_what_is_the_reasoning_behind_the/,0,0,0,26,0,,31,Satans_Paw
694,1336848073.0,True,True,False,False,False,False,t5_2ruq7,r/southpaws,21110,Do other lefties do this?,/r/southpaws/comments/tjxqv/do_other_lefties_do_this/,0,0,0,40,0,,32,
695,1326469450.0,True,True,False,False,False,False,t5_2ruq7,r/southpaws,21110,It makes me so happy when someone gives me a lefty handshake.,/r/southpaws/comments/ofiym/it_makes_me_so_happy_when_someone_gives_me_a/,0,0,0,12,0,,34,Attuma
696,1314844705.0,True,False,False,False,False,False,t5_2ruq7,r/southpaws,21110,"At last, our comeuppance! (comment x-post; be sure to see the headline image)",/r/southpaws/comments/k0vxx/at_last_our_comeuppance_comment_xpost_be_sure_to/,0,0,0,5,0,,30,gmcg_abidesII
697,1305713325.0,True,False,False,False,False,False,t5_2ruq7,r/southpaws,21110,I work in Shanghai and I've had multiple people tell me it's wrong/weird to use chopsticks with my left hand. The dextrocentrism here is a lot worse than in the West!,/r/southpaws/comments/he3my/i_work_in_shanghai_and_ive_had_multiple_people/,0,0,0,23,0,,31,
698,1305221044.0,True,True,False,False,False,False,t5_2ruq7,r/southpaws,21110,Congratulations to Southpaws new mod,/r/southpaws/comments/h9wk8/congratulations_to_southpaws_new_mod/,0,0,0,6,0,,32,RipperM
699,1301015965.0,True,True,False,False,False,False,t5_2ruq7,r/southpaws,21110,/r/southpaws entered in PimpMyReddit,/r/southpaws/comments/gaxhu/rsouthpaws_entered_in_pimpmyreddit/,0,0,0,1,0,,34,RipperM
700,1574553262.0,True,True,False,False,False,False,t5_2ruq7,r/southpaws,21110,How you convince your parents that you are truly left handed?,/r/southpaws/comments/e0qf9x/how_you_convince_your_parents_that_you_are_truly/,0,0,0,42,0,,32,ToonlinkFTW890
701,1572446713.0,True,True,False,False,False,False,t5_2ruq7,r/southpaws,21110,"Interesting question on r/askreddit...""When you were a child, what side did you draw a sun on? The left or the right?""",/r/southpaws/comments/dp7pdf/interesting_question_on_raskredditwhen_you_were_a/,0,0,0,31,0,,34,ToonlinkFTW890
702,1567921085.0,True,True,False,False,False,False,t5_2ruq7,r/southpaws,21110,WASD left handed equivalent,/r/southpaws/comments/d173q6/wasd_left_handed_equivalent/,0,0,0,36,0,,34,Crescent___Moon
703,1567642768.0,True,True,False,False,False,False,t5_2ruq7,r/southpaws,21110,I sneeze to the left anyone else?,/r/southpaws/comments/czt98v/i_sneeze_to_the_left_anyone_else/,0,0,0,16,0,,31,Inkd_Bella
704,1546021970.0,True,True,False,False,False,False,t5_2ruq7,r/southpaws,21110,Kicking,/r/southpaws/comments/aacweh/kicking/,0,0,0,23,0,,32,Dirtysox23
705,1539838722.0,True,True,False,False,False,False,t5_2ruq7,r/southpaws,21110,"I'm embarking on an experiment, wish me luck!",/r/southpaws/comments/9p65jz/im_embarking_on_an_experiment_wish_me_luck/,0,0,0,11,0,,32,lyricalyre
706,1527767576.0,True,True,False,False,False,False,t5_2ruq7,r/southpaws,21110,Is there an internationally recognized Left Handed symbol?,/r/southpaws/comments/8nhsfe/is_there_an_internationally_recognized_left/,0,0,0,16,0,,34,GanasbinTagap
707,1524428799.0,True,True,False,False,False,False,t5_2ruq7,r/southpaws,21110,I have a unique problem,/r/southpaws/comments/8e5y4m/i_have_a_unique_problem/,0,0,0,17,0,,32,charliemuffin
708,1503176536.0,True,True,False,False,False,False,t5_2ruq7,r/southpaws,21110,Handedness in my profession,/r/southpaws/comments/6urkir/handedness_in_my_profession/,0,0,0,21,0,,32,delarye1
709,1474902551.0,True,True,False,False,False,False,t5_2ruq7,r/southpaws,21110,Ball pens for lefties?,/r/southpaws/comments/54l1a5/ball_pens_for_lefties/,0,0,0,40,0,,30,Agdain
710,1473005767.0,True,True,False,False,False,False,t5_2ruq7,r/southpaws,21110,Parent seeking advice for left-handed child,/r/southpaws/comments/514mzh/parent_seeking_advice_for_lefthanded_child/,0,0,0,94,0,,35,
711,1464032054.0,True,True,False,False,False,False,t5_2ruq7,r/southpaws,21110,"For gamers, do you find yourself better at strafing than at aiming?",/r/southpaws/comments/4kpqv1/for_gamers_do_you_find_yourself_better_at/,0,0,0,23,0,,33,HollowGalaxy
712,1458195164.0,True,True,False,False,False,False,t5_2ruq7,r/southpaws,21110,Why do some left handed actors pretend to be right handed?,/r/southpaws/comments/4arsbv/why_do_some_left_handed_actors_pretend_to_be/,0,0,0,28,0,,33,MacASM
713,1431475517.0,True,True,False,False,False,False,t5_2ruq7,r/southpaws,21110,Yik Yak has a left hand mode. Because yes.,/r/southpaws/comments/35rurc/yik_yak_has_a_left_hand_mode_because_yes/,0,0,0,5,0,,29,chibot
714,1430680445.0,True,True,False,False,False,False,t5_2ruq7,r/southpaws,21110,Why and how were lefties ever forced to write with their right hand in school?,/r/southpaws/comments/34qs4g/why_and_how_were_lefties_ever_forced_to_write/,0,0,0,41,0,,33,lirannl
715,1402749930.0,True,True,False,False,False,False,t5_2ruq7,r/southpaws,21110,Could I have been born left-handed?,/r/southpaws/comments/284lsz/could_i_have_been_born_lefthanded/,0,0,0,20,0,,29,digitalstomp
716,1377414152.0,True,True,False,False,False,False,t5_2ruq7,r/southpaws,21110,Bad Teachers,/r/southpaws/comments/1l1oje/bad_teachers/,0,0,0,34,0,,31,misfitx
717,1376363988.0,True,False,False,False,False,False,t5_2ruq7,r/southpaws,21110,TIL this is a thing... and it's today!,/r/southpaws/comments/1k964z/til_this_is_a_thing_and_its_today/,0,0,0,0,0,,32,jennnnnnnnnn
718,1376242577.0,True,True,False,False,False,False,t5_2ruq7,r/southpaws,21110,Why do some teachers force left handed people to become right handed?,/r/southpaws/comments/1k5iu8/why_do_some_teachers_force_left_handed_people_to/,0,0,0,48,0,,31,MyRedditacnt
719,1375220839.0,True,False,False,False,False,False,t5_2ruq7,r/southpaws,21110,"Razer revamps Naga MMO mouse with mechanical switches, left-handed model",/r/southpaws/comments/1jdmdn/razer_revamps_naga_mmo_mouse_with_mechanical/,0,0,0,14,0,,35,drcross
720,1357600762.0,True,True,False,False,False,False,t5_2ruq7,r/southpaws,21110,Do more lefties use inverted controls for gaming?,/r/southpaws/comments/165cj4/do_more_lefties_use_inverted_controls_for_gaming/,0,0,0,51,0,,34,skeigh
721,1348697338.0,True,True,False,False,False,False,t5_2ruq7,r/southpaws,21110,Imagine this:,/r/southpaws/comments/10j3ke/imagine_this/,0,0,0,9,0,,32,
722,1333597774.0,True,False,False,False,False,False,t5_2ruq7,r/southpaws,21110,Middle Ages. [x-post from /r/atheism],/r/southpaws/comments/ru4bu/middle_ages_xpost_from_ratheism/,0,0,0,2,0,,33,GoodGuyGuitar
723,1313110557.0,True,True,False,False,False,False,t5_2ruq7,r/southpaws,21110,the best thing about being a lefty (and having a right handed girlfriend),/r/southpaws/comments/jga1g/the_best_thing_about_being_a_lefty_and_having_a/,0,0,0,23,0,,30,CombatBeard
724,1630616838.0,True,True,False,False,False,False,t5_2ruq7,r/southpaws,21110,Anyone else prefer to listen to music in their right ears?,/r/southpaws/comments/pgqsyo/anyone_else_prefer_to_listen_to_music_in_their/,1,0,0,31,0,,33,Gibby121200
725,1605340675.0,True,True,False,False,False,False,t5_2ruq7,r/southpaws,21110,Looking for a left-handed conductor,/r/southpaws/comments/jtyg6g/looking_for_a_lefthanded_conductor/,0,0,0,18,0,,33,Cat-a-saur
726,1603723119.0,True,True,False,False,False,False,t5_2ruq7,r/southpaws,21110,Do we have a advantage in fighting because we are left handed?,/r/southpaws/comments/jifpcy/do_we_have_a_advantage_in_fighting_because_we_are/,0,0,0,16,0,,31,Csalz94009
727,1596443008.0,True,True,False,False,False,False,t5_2ruq7,r/southpaws,21110,Calligraphy?,/r/southpaws/comments/i2tbgp/calligraphy/,0,0,0,8,0,,31,TheSquishyFish
728,1583191443.0,True,True,False,False,False,False,t5_2ruq7,r/southpaws,21110,Are arcade joysticks and modern day joypads an advantage for left hand players or a hindrance?,/r/southpaws/comments/fcl49c/are_arcade_joysticks_and_modern_day_joypads_an/,0,0,0,8,0,,31,Nomads-Game-Rants
729,1580093889.0,True,True,False,False,False,False,t5_2ruq7,r/southpaws,21110,What was your GPA in High-School?,/r/southpaws/comments/euhq07/what_was_your_gpa_in_highschool/,0,0,0,116,0,,32,Necromaniacx
730,1577531314.0,True,True,False,False,False,False,t5_2ruq7,r/southpaws,21110,How do you play games?,/r/southpaws/comments/egpm10/how_do_you_play_games/,0,0,0,35,0,,27,tsarofblin
731,1574135283.0,True,True,False,False,False,False,t5_2ruq7,r/southpaws,21110,Even though I use my left hand to write if you asked me to shoot a basketball I would shoot righty DAE?,/r/southpaws/comments/dyezmm/even_though_i_use_my_left_hand_to_write_if_you/,0,0,0,17,0,,31,ToonlinkFTW890
732,1563135621.0,True,True,False,False,False,False,t5_2ruq7,r/southpaws,21110,Is there anyone who is exclusively left handed?,/r/southpaws/comments/cd7pmm/is_there_anyone_who_is_exclusively_left_handed/,0,0,0,39,0,,30,big-shotFaker
733,1557646398.0,True,True,False,False,False,False,t5_2ruq7,r/southpaws,21110,"Is there a term for ""correcting"" a left-handed person to use the right hand?",/r/southpaws/comments/bnmh75/is_there_a_term_for_correcting_a_lefthanded/,0,0,0,22,0,,35,fanism
734,1542042990.0,True,True,False,False,False,False,t5_2ruq7,r/southpaws,21110,Southpaw Survey,/r/southpaws/comments/9wfvzj/southpaw_survey/,0,0,0,16,0,,33,AntiLegendZz
735,1519431197.0,True,True,False,False,False,False,t5_2ruq7,r/southpaws,21110,Do lefties/mixed handed individuals have a bad sense of direction usually?,/r/southpaws/comments/7zssx8/do_leftiesmixed_handed_individuals_have_a_bad/,0,0,0,44,0,,32,Italianabanana
736,1518389316.0,True,True,False,False,False,False,t5_2ruq7,r/southpaws,21110,3 lefties out of 4 siblings.,/r/southpaws/comments/7ww9nf/3_lefties_out_of_4_siblings/,0,0,0,25,0,,31,redtractorbeam
737,1485477066.0,True,True,False,False,False,False,t5_2ruq7,r/southpaws,21110,For honor should we get our own option,/r/southpaws/comments/5qe14e/for_honor_should_we_get_our_own_option/,0,0,0,6,0,,31,Cy3x
738,1476048872.0,True,True,False,False,False,False,t5_2ruq7,r/southpaws,21110,ii am learning to write left handed,/r/southpaws/comments/56of79/ii_am_learning_to_write_left_handed/,0,0,0,21,0,,33,bailbondshhman
739,1455084884.0,True,True,False,False,False,False,t5_2ruq7,r/southpaws,21110,Has anyone noticied the huge number of left handeders on Seinfeld serie?,/r/southpaws/comments/451d09/has_anyone_noticied_the_huge_number_of_left/,0,0,0,19,0,,31,MacASM
740,1449862761.0,True,True,False,False,False,False,t5_2ruq7,r/southpaws,21110,How many people in your family are left handed?,/r/southpaws/comments/3wf180/how_many_people_in_your_family_are_left_handed/,0,0,0,78,0,,30,grebilrancher
741,1440721056.0,True,True,False,False,False,False,t5_2ruq7,r/southpaws,21110,How do you play guitar?,/r/southpaws/comments/3inz02/how_do_you_play_guitar/,0,0,0,41,0,,31,MoistWalrus
742,1421359985.0,True,True,False,False,False,False,t5_2ruq7,r/southpaws,21110,2015 Goal: Left Handed Drawing,/r/southpaws/comments/2sk9hi/2015_goal_left_handed_drawing/,0,0,0,5,0,,29,ch3micaljoe
743,1420866678.0,True,False,False,False,False,False,t5_2ruq7,r/southpaws,21110,Proofs That The World Is A Bit Unfair For Left-handed People,/r/southpaws/comments/2rxr15/proofs_that_the_world_is_a_bit_unfair_for/,0,0,0,33,0,,30,jimmy349
744,1411582380.0,True,True,False,False,False,False,t5_2ruq7,r/southpaws,21110,"When talking on the phone, are you able to/do you switch from ear to ear or do you predominantly use only your left ear?",/r/southpaws/comments/2hcogy/when_talking_on_the_phone_are_you_able_todo_you/,0,0,0,31,0,,33,drunkenmormon
745,1410581801.0,True,True,False,False,False,False,t5_2ruq7,r/southpaws,21110,Question: Which arm do you wear your watch on?,/r/southpaws/comments/2g9j4j/question_which_arm_do_you_wear_your_watch_on/,0,0,0,87,0,,31,magicnumber90
746,1406299928.0,True,False,False,False,False,False,t5_2ruq7,r/southpaws,21110,Marvel Reimagines Green Goblin As Left-Handed | The Onion,/r/southpaws/comments/2bp1x6/marvel_reimagines_green_goblin_as_lefthanded_the/,0,0,0,4,0,,34,madcowga
747,1374162159.0,True,False,False,False,False,False,t5_2ruq7,r/southpaws,21110,Left-Handed Guitarists: the Famous and the Facts [article],/r/southpaws/comments/1ikc6a/lefthanded_guitarists_the_famous_and_the_facts/,0,0,0,12,0,,31,
748,1369038414.0,True,True,False,False,False,False,t5_2ruq7,r/southpaws,21110,Do we have a mecca? Any places worth going for lefties?,/r/southpaws/comments/1eomgx/do_we_have_a_mecca_any_places_worth_going_for/,0,0,0,11,0,,31,KingGorilla
749,1363384085.0,True,True,False,False,False,False,t5_2ruq7,r/southpaws,21110,Belts,/r/southpaws/comments/1adifn/belts/,0,0,0,36,0,,33,Kurdt99
750,1363378812.0,True,False,False,False,False,False,t5_2ruq7,r/southpaws,21110,A Left-Handed Compliment by Dave Barry,/r/southpaws/comments/1adc1z/a_lefthanded_compliment_by_dave_barry/,0,0,0,2,0,,32,crazy-ex
751,1361666046.0,True,True,False,False,False,False,t5_2ruq7,r/southpaws,21110,Righty friend flipped,/r/southpaws/comments/193v0z/righty_friend_flipped/,0,0,0,22,0,,28,dont_ask_my_cab
752,1336600686.0,True,True,False,False,False,False,t5_2ruq7,r/southpaws,21110,Left-handed Team Names,/r/southpaws/comments/tfemm/lefthanded_team_names/,0,0,0,15,0,,31,robotreader
753,1326704951.0,True,True,False,False,False,False,t5_2ruq7,r/southpaws,21110,Are lefties really in more artistic/creative pursuits?,/r/southpaws/comments/oj4dm/are_lefties_really_in_more_artisticcreative/,0,0,0,56,0,,31,
754,1319950887.0,True,False,False,False,False,False,t5_2ruq7,r/southpaws,21110,"""The mystery of left-handedness."" - I saw this on r/news today. I just found this subreddit, and thought my fellow lefties might appreciate it.",/r/southpaws/comments/ltv01/the_mystery_of_lefthandedness_i_saw_this_on_rnews/,0,0,0,6,0,,29,mediocreearthling
755,1296075078.0,True,True,False,False,False,False,t5_2ruq7,r/southpaws,21110,The worst part about being left handed in school...,/r/southpaws/comments/f9kjb/the_worst_part_about_being_left_handed_in_school/,0,0,0,40,0,,30,sirjimihendrix
756,1630924806.0,True,True,False,False,False,False,t5_2ruq7,r/southpaws,21110,Study on word valance and handedness,/r/southpaws/comments/piwzef/study_on_word_valance_and_handedness/,1,0,0,26,0,,30,catdogratlefthander
757,1608789433.0,True,True,False,False,False,False,t5_2ruq7,r/southpaws,21110,You're about to get hit by a ball which arm or hand do you instinctively and reflexively use to block the ball?,/r/southpaws/comments/kj9ytc/youre_about_to_get_hit_by_a_ball_which_arm_or/,0,0,0,24,0,,31,ToonlinkFTW890
758,1603419565.0,True,True,False,False,False,False,t5_2ruq7,r/southpaws,21110,Name of handwriting for lefties sub poll,/r/southpaws/comments/jge2zf/name_of_handwriting_for_lefties_sub_poll/,0,0,0,10,0,,26,ToonlinkFTW890
759,1591947021.0,True,True,False,False,False,False,t5_2ruq7,r/southpaws,21110,Handwriting influencing test grade,/r/southpaws/comments/h7g7c2/handwriting_influencing_test_grade/,0,0,0,15,0,,30,notadoctorshhhhhhhh
760,1587768887.0,True,True,False,False,False,False,t5_2ruq7,r/southpaws,21110,"Trying to get better at writing, but my leftie status makes it difficult.",/r/southpaws/comments/g7iiwg/trying_to_get_better_at_writing_but_my_leftie/,0,0,0,19,0,,28,Raspint
761,1584849977.0,True,True,False,False,False,False,t5_2ruq7,r/southpaws,21110,How do you open bottles?,/r/southpaws/comments/fmtnt9/how_do_you_open_bottles/,0,0,0,15,0,,30,
762,1570684125.0,True,True,False,False,False,False,t5_2ruq7,r/southpaws,21110,No functional pen for lefties.,/r/southpaws/comments/dft8bp/no_functional_pen_for_lefties/,0,0,0,26,0,,30,
763,1564170854.0,True,True,False,False,False,False,t5_2ruq7,r/southpaws,21110,What is the most annoying thing about being left handed in your opinion?,/r/southpaws/comments/ci7lyf/what_is_the_most_annoying_thing_about_being_left/,0,0,0,79,0,,30,ToonlinkFTW890
764,1521313570.0,True,True,False,False,False,False,t5_2ruq7,r/southpaws,21110,How do you use a fountain pen?,/r/southpaws/comments/855wg3/how_do_you_use_a_fountain_pen/,0,0,0,25,0,,30,MacASM
765,1515653390.0,True,True,False,False,False,False,t5_2ruq7,r/southpaws,21110,Check marks,/r/southpaws/comments/7pmbye/check_marks/,0,0,0,21,0,,30,caturdayalldaylong
