,created_utc,is_crosspostable,is_self,is_video,locked,media_only,over_18,subreddit_id,subreddit_name_prefixed,subreddit_subscribers,title,permalink,total_awards_received,downs,gilded,num_comments,num_crossposts,num_reports,ups,author_name
1455,1610861212.0,True,False,True,False,False,False,t5_2qugx,r/delhi,215054,"Last to last night, I was on my rooftop and around 10:30 this happened.",/r/delhi/comments/kz0a1i/last_to_last_night_i_was_on_my_rooftop_and_around/,1,0,0,55,1,,377,Lovenish_lk
1456,1598089365.0,True,False,False,False,False,False,t5_2qugx,r/delhi,215054,Early mornings in Chittaranjan Park,/r/delhi/comments/iefok9/early_mornings_in_chittaranjan_park/,0,0,0,6,0,,368,ankitacmilan1
1457,1628314664.0,True,False,False,False,False,False,t5_2qugx,r/delhi,215054,Newly built Ashok Hotel (1950s),/r/delhi/comments/oznkbu/newly_built_ashok_hotel_1950s/,3,0,0,11,2,,373,sajaypal007
1458,1636035631.0,True,True,False,False,False,False,t5_2qugx,r/delhi,215054,"It's heartbreaking seeing how many houses don't have lights today, mine included.",/r/delhi/comments/qmln5q/its_heartbreaking_seeing_how_many_houses_dont/,5,0,0,44,0,,367,first_name_harshit
1459,1649061561.0,True,False,False,False,False,False,t5_2qugx,r/delhi,215054,Social inequality,/r/delhi/comments/tvx3g6/social_inequality/,0,0,0,97,0,,370,average69monke
1460,1625336451.0,True,False,False,False,False,False,t5_2qugx,r/delhi,215054,The Ridge Chronicles.,/r/delhi/comments/od3ezi/the_ridge_chronicles/,2,0,0,18,1,,370,callmeIshmael84
1461,1599900856.0,True,False,False,False,False,False,t5_2qugx,r/delhi,215054,British destroyed these houses after the revolt to have clear field in front of Red fort. Photograph of 1858 by F Beato (Before) and 1895 by Lawrey & co (After).,/r/delhi/comments/ir96tv/british_destroyed_these_houses_after_the_revolt/,0,0,0,22,2,,370,sajaypal007
1462,1640437823.0,True,False,False,False,False,False,t5_2qugx,r/delhi,215054,Stay safe guys,/r/delhi/comments/ro9jvu/stay_safe_guys/,1,0,0,44,0,,370,WeaponX23X
1463,1629713902.0,True,False,False,False,False,False,t5_2qugx,r/delhi,215054,"I boarded the Delhi metro today after so long. Almost 6 months or so. Idk it feels so nice. To be out on my own 🥺 I live w my family, don't get me wrong they're good people but it's been 1.5 years we're under the same roof w lil to no new faces. It's a struggle to stay sane sometimes.",/r/delhi/comments/p9wvtu/i_boarded_the_delhi_metro_today_after_so_long/,4,0,0,36,0,,371,Dickbag4206969
1464,1613613130.0,True,False,False,False,False,False,t5_2qugx,r/delhi,215054,Caption Ideas please :P :),/r/delhi/comments/lmar5e/caption_ideas_please_p/,1,0,0,69,0,,368,shashank_aggarwal
1465,1606277178.0,True,False,False,False,False,False,t5_2qugx,r/delhi,215054,Just another busy morning in Old Delhi,/r/delhi/comments/k0ksm3/just_another_busy_morning_in_old_delhi/,2,0,0,22,0,,365,soloforsolong
1466,1608967744.0,True,False,False,False,False,False,t5_2qugx,r/delhi,215054,Delhi barbers still in 2006,/r/delhi/comments/kker37/delhi_barbers_still_in_2006/,0,0,0,20,0,,365,deathclown97
1467,1604760584.0,True,False,False,False,False,False,t5_2qugx,r/delhi,215054,"World War 1 memorial, Mehrauli",/r/delhi/comments/jps22r/world_war_1_memorial_mehrauli/,1,0,0,9,0,,368,Perfectstranger01
1468,1642944630.0,True,False,True,False,False,False,t5_2qugx,r/delhi,215054,"Delhi Tech. University, Badli",/r/delhi/comments/satook/delhi_tech_university_badli/,2,0,0,100,1,,368,dukhi_insaan
1469,1636112993.0,True,False,True,False,False,False,t5_2qugx,r/delhi,215054,Wind direction is taking all the stubble smoke to Delhi. We should be thankful to Haryana for minimising stubble burning this year,/r/delhi/comments/qn9ecy/wind_direction_is_taking_all_the_stubble_smoke_to/,1,0,0,51,0,,363,anny007
1470,1612347283.0,True,False,False,False,False,False,t5_2qugx,r/delhi,215054,My best of Delhi [OC],/r/delhi/comments/lbkk93/my_best_of_delhi_oc/,4,0,0,27,1,,365,timfuzail
1471,1604065809.0,True,False,False,False,False,False,t5_2qugx,r/delhi,215054,"Gentlemen feeding stray dogs near Jain Book Depot, CP",/r/delhi/comments/jkx3m5/gentlemen_feeding_stray_dogs_near_jain_book_depot/,4,0,0,25,0,,367,Perfectstranger01
1472,1649125283.0,True,False,False,False,False,False,t5_2qugx,r/delhi,215054,"Person buying fruits from the vendor, background of several movie promotions. New Delhi 1950s",/r/delhi/comments/twk9n4/person_buying_fruits_from_the_vendor_background/,0,0,0,16,0,,361,First_Sherbert_4405
1473,1647265448.0,True,True,False,False,False,False,t5_2qugx,r/delhi,215054,First coach in the metro is reserved for ladies... and men are so salty about it!,/r/delhi/comments/tdxtjt/first_coach_in_the_metro_is_reserved_for_ladies/,0,0,0,119,0,,360,angelicbutsatanic
1474,1639568492.0,True,False,False,False,False,False,t5_2qugx,r/delhi,215054,When i asked the owner about the number plate!He replied and said “Zindagi J#@@t ban chuki hai is number ke vajah se.”,/r/delhi/comments/rgx78b/when_i_asked_the_owner_about_the_number_platehe/,2,0,0,42,0,,369,Playful-Carpenter274
1475,1625551681.0,True,False,True,False,False,False,t5_2qugx,r/delhi,215054,Waves after rain,/r/delhi/comments/oep2ut/waves_after_rain/,2,0,0,50,0,,365,S-H-U-B-H-A-M
1476,1641631617.0,True,False,False,False,False,False,t5_2qugx,r/delhi,215054,Saw these cute kittens on my scooty this morning,/r/delhi/comments/ryvgfe/saw_these_cute_kittens_on_my_scooty_this_morning/,4,0,0,16,0,,359,___hrithikverma___
1477,1636817325.0,True,False,False,False,False,False,t5_2qugx,r/delhi,215054,So delhites how many times you been here?,/r/delhi/comments/qt3j7g/so_delhites_how_many_times_you_been_here/,0,0,0,131,0,,355,Explorer_sun
1478,1626788878.0,True,False,False,False,False,False,t5_2qugx,r/delhi,215054,Weather after a nice rain in my area 🔥,/r/delhi/comments/oo2dbw/weather_after_a_nice_rain_in_my_area/,0,0,0,27,0,,360,dv_singh97
1479,1650371135.0,True,False,False,False,False,False,t5_2qugx,r/delhi,215054,I really don’t know why but…,/r/delhi/comments/u73xju/i_really_dont_know_why_but/,0,0,0,87,0,,358,dexterpanda2
1480,1648630809.0,True,False,False,False,False,False,t5_2qugx,r/delhi,215054,Go VEGAN,/r/delhi/comments/ts25ua/go_vegan/,0,0,0,277,1,,365,BeingMemeholic
1481,1588997302.0,True,False,False,False,False,False,t5_2qugx,r/delhi,215054,Food provided by Delhi Govt to COVID-19 patients in Delhi and to those who were under Isolation in hospital.,/r/delhi/comments/gg8hm9/food_provided_by_delhi_govt_to_covid19_patients/,0,0,0,40,0,,358,IndiaObserversReddit
1482,1649071502.0,True,False,True,False,False,False,t5_2qugx,r/delhi,215054,"I recorded this back in January from metro,, omw to college around 7in morning..",/r/delhi/comments/tvzneh/i_recorded_this_back_in_january_from_metro_omw_to/,0,0,0,42,0,,361,suspisusChad
1483,1645014134.0,True,False,False,False,False,False,t5_2qugx,r/delhi,215054,"DO NOT, I repeat, DO NOT smoke in CP. Though there was a ban on smoking in public places for a long time, it is being enforced very efficiently in CP now. The civil defense volunteer hide somewhere around the Cigarette shops and pounce on you when you light one.",/r/delhi/comments/stum77/do_not_i_repeat_do_not_smoke_in_cp_though_there/,1,0,0,79,0,,363,john_wick_909
1484,1617456198.0,True,False,False,False,False,False,t5_2qugx,r/delhi,215054,Technically they don't even Care!,/r/delhi/comments/mj8f47/technically_they_dont_even_care/,1,0,0,21,0,,355,Please_No_More_Potty
1485,1629863543.0,True,False,False,False,False,False,t5_2qugx,r/delhi,215054,"Minto Bridge, 1990",/r/delhi/comments/pb3e6y/minto_bridge_1990/,0,0,0,34,0,,353,sajaypal007
1486,1627372813.0,True,False,True,False,False,False,t5_2qugx,r/delhi,215054,"Morning Ride, floating auto.",/r/delhi/comments/osihti/morning_ride_floating_auto/,1,0,0,48,0,,358,RankYouHigher
1487,1584873283.0,True,False,False,False,False,False,t5_2qugx,r/delhi,215054,When the air quality is finally below 100 but you can't go outside.,/r/delhi/comments/fmxxa5/when_the_air_quality_is_finally_below_100_but_you/,0,0,0,10,0,,359,reva_r
1488,1643906080.0,True,False,False,False,False,False,t5_2qugx,r/delhi,215054,Who’s guilty of doing this?,/r/delhi/comments/sjnlb1/whos_guilty_of_doing_this/,0,0,0,62,0,,356,Beginning-Editor5453
1489,1627911504.0,True,False,False,False,False,False,t5_2qugx,r/delhi,215054,"I did this baby shoot with TV tower in background but client says this picture is spooky and it reminds her of horror movie ""Annabelle"". What is your opinion about it Delhiwaalo?",/r/delhi/comments/owepcz/i_did_this_baby_shoot_with_tv_tower_in_background/,0,0,0,113,0,,361,polerturefilms
1490,1609909265.0,True,False,False,False,False,False,t5_2qugx,r/delhi,215054,Gurudwara Shri Bangla Sahib. Night sky,/r/delhi/comments/krgt9l/gurudwara_shri_bangla_sahib_night_sky/,3,0,0,10,1,,356,ashi_02734
1491,1613279374.0,True,False,False,False,False,False,t5_2qugx,r/delhi,215054,"Inspired by another post, foggy mornings in Lodi Garden",/r/delhi/comments/ljhxne/inspired_by_another_post_foggy_mornings_in_lodi/,2,0,0,18,0,,354,first_name_harshit
1492,1610687138.0,True,False,False,False,False,False,t5_2qugx,r/delhi,215054,What 400+ AQI looks like. Today morning at Nehru Park. [OC],/r/delhi/comments/kxnkxc/what_400_aqi_looks_like_today_morning_at_nehru/,0,0,0,39,0,,355,
1493,1603464506.0,True,False,False,False,False,False,t5_2qugx,r/delhi,215054,An image of Delhi circa 1866,/r/delhi/comments/jgoidz/an_image_of_delhi_circa_1866/,0,0,0,26,0,,350,doors_2
1494,1648783277.0,True,True,False,False,False,False,t5_2qugx,r/delhi,215054,We're Beautiful.,/r/delhi/comments/tth27h/were_beautiful/,5,0,0,126,0,,354,lilacinspring
1495,1606115499.0,True,False,False,False,False,False,t5_2qugx,r/delhi,215054,I’m sorry for spamming here but it is related to parents and kids across Delhi NCR. A very important issue!,/r/delhi/comments/jzd00u/im_sorry_for_spamming_here_but_it_is_related_to/,1,0,0,34,0,,350,jamesmoi
1496,1641286577.0,True,False,False,False,False,False,t5_2qugx,r/delhi,215054,"This is District center's building. Apparently, alot of people started attempting sui###e here, it was the tallest building here, before tall buildings started becoming common here in Delhi. Now it's not allowed to go on the top floor. Feels scary sitting right here.",/r/delhi/comments/rvpyx8/this_is_district_centers_building_apparently_alot/,0,0,0,109,0,,352,
1497,1606366491.0,True,False,False,False,False,False,t5_2qugx,r/delhi,215054,Good morning !,/r/delhi/comments/k18pek/good_morning/,0,0,0,16,0,,352,Ravinepz
1498,1606061395.0,True,False,False,False,False,False,t5_2qugx,r/delhi,215054,"Today's clear sky, taken at 5:30pm.",/r/delhi/comments/jyy3ox/todays_clear_sky_taken_at_530pm/,2,0,0,13,0,,352,kishm1sh
1499,1648190136.0,True,False,False,False,False,False,t5_2qugx,r/delhi,215054,New developments in Rani Bagh area.,/r/delhi/comments/tnfw0x/new_developments_in_rani_bagh_area/,0,0,0,83,0,,352,aseemkujur
1500,1645448058.0,True,False,False,False,False,False,t5_2qugx,r/delhi,215054,"Name a more lovable and silent place in Delhi, I'll wait 😌",/r/delhi/comments/sxsuhf/name_a_more_lovable_and_silent_place_in_delhi_ill/,1,0,0,103,0,,349,insanig
1501,1643517018.0,True,False,True,False,False,False,t5_2qugx,r/delhi,215054,was a good day yesterday. south ex to rdx.,/r/delhi/comments/sg0s0c/was_a_good_day_yesterday_south_ex_to_rdx/,0,0,0,43,0,,353,woodstockbird9
1502,1642069923.0,True,False,True,False,False,False,t5_2qugx,r/delhi,215054,Hazrat Nizamuddin Dargah. New Delhi,/r/delhi/comments/s2whd3/hazrat_nizamuddin_dargah_new_delhi/,1,0,0,52,1,,355,dukhi_insaan
1503,1636620412.0,True,False,False,False,False,False,t5_2qugx,r/delhi,215054,Ye dilli h mere yaar♥️,/r/delhi/comments/qrgxu7/ye_dilli_h_mere_yaar/,1,0,0,40,0,,353,Delhi_boy2405
1504,1612603726.0,True,False,False,False,False,False,t5_2qugx,r/delhi,215054,Heh So the spring has arrived huh.,/r/delhi/comments/ldtwgb/heh_so_the_spring_has_arrived_huh/,0,0,0,17,0,,347,
1505,1606451708.0,True,False,False,False,False,False,t5_2qugx,r/delhi,215054,"Paris: There's only one Eiffel Tower in the world and I have it!! Delhi: Well, technically.....",/r/delhi/comments/k1uejv/paris_theres_only_one_eiffel_tower_in_the_world/,1,0,0,33,0,,351,mickey_with_a_hickey
1506,1645005013.0,True,False,False,False,False,False,t5_2qugx,r/delhi,215054,People Of r/delhi confess your sins. Tell The bad things you have ever done (i saw this on r/ Chennai and Hyderabad),/r/delhi/comments/sts4o5/people_of_rdelhi_confess_your_sins_tell_the_bad/,4,0,0,701,1,,352,CGEmonJ
1507,1595133612.0,True,False,False,False,False,False,t5_2qugx,r/delhi,215054,"More of what makes Delhi. The kicker, truly, is the name of the place - Playgue.",/r/delhi/comments/htut2c/more_of_what_makes_delhi_the_kicker_truly_is_the/,0,0,0,24,0,,347,shwetakoshy
1508,1626345794.0,True,False,False,False,False,False,t5_2qugx,r/delhi,215054,Aaj mei free hu socha aaj “Delhi rain” spam karunga 😭,/r/delhi/comments/okqadf/aaj_mei_free_hu_socha_aaj_delhi_rain_spam_karunga/,0,0,0,12,0,,349,samosabiceps
1509,1620098807.0,True,True,False,False,False,False,t5_2qugx,r/delhi,215054,Please don't forward messages about adopting children of parents who have died due to Covid,/r/delhi/comments/n4exxa/please_dont_forward_messages_about_adopting/,4,0,0,11,0,,344,sharmaamit92
1510,1624373289.0,True,False,False,False,False,False,t5_2qugx,r/delhi,215054,"Jumbo point, dwarka sector-9",/r/delhi/comments/o5ouun/jumbo_point_dwarka_sector9/,0,0,0,24,0,,350,helium_balloon98
1511,1627121688.0,True,False,False,False,False,False,t5_2qugx,r/delhi,215054,Nothing can beat these weekday market cholle bhatore. Friday market. West delhi.,/r/delhi/comments/oqnay2/nothing_can_beat_these_weekday_market_cholle/,1,0,0,103,0,,347,letmeadviceU
1512,1608092094.0,True,False,False,False,False,False,t5_2qugx,r/delhi,215054,Stumbled upon a park while walking around in Civil Lines. Only in Delhi can you go out for a walk and find Mughal architecture in your neighborhood without having planned to see it.,/r/delhi/comments/ke22gb/stumbled_upon_a_park_while_walking_around_in/,2,0,0,28,0,,350,Medium_Carrot
1513,1644385548.0,True,False,False,False,False,False,t5_2qugx,r/delhi,215054,"Very Friendly cat spotted at Ashirbad Caterers Market no 3, CR PARK",/r/delhi/comments/so5z89/very_friendly_cat_spotted_at_ashirbad_caterers/,1,0,0,29,0,,348,InevitablePlankton53
1514,1622478238.0,True,False,False,False,False,False,t5_2qugx,r/delhi,215054,Administration in this country is a joke right now. Is this how you fucking price a vaccine in a goddamn pandemic? There's more uniformity than this in the price of basmati chawal.,/r/delhi/comments/np78xu/administration_in_this_country_is_a_joke_right/,1,0,0,147,0,,343,Rover211
1515,1648284214.0,True,False,False,False,False,False,t5_2qugx,r/delhi,215054,"From the Delhi Budget, street food promotion is kaafi cool imo. Helps build culture in the city",/r/delhi/comments/tokcfp/from_the_delhi_budget_street_food_promotion_is/,0,0,0,46,0,,342,excuseme_wtf
1516,1635255451.0,True,False,False,False,False,False,t5_2qugx,r/delhi,215054,Khan Market,/r/delhi/comments/qg6kti/khan_market/,0,0,0,21,0,,348,bognarwhal
1517,1632339003.0,True,False,True,False,False,False,t5_2qugx,r/delhi,215054,"Dilliwaalo, we are 100K!!! 🥳🥳🥳",/r/delhi/comments/ptf2cl/dilliwaalo_we_are_100k/,0,0,0,64,0,,338,agued5
1518,1630773832.0,True,False,False,False,False,False,t5_2qugx,r/delhi,215054,Bus dilli se thoda bahar ..,/r/delhi/comments/phuzir/bus_dilli_se_thoda_bahar/,3,0,0,43,0,,340,ar_prashantvarun4
1519,1593900942.0,True,False,False,False,False,False,t5_2qugx,r/delhi,215054,Sweatbucket.exe,/r/delhi/comments/hlbt7s/sweatbucketexe/,0,0,0,8,0,,341,Ash6323
1520,1581006055.0,True,False,False,False,False,False,t5_2qugx,r/delhi,215054,The Hero we deserve,/r/delhi/comments/ezun8x/the_hero_we_deserve/,0,0,0,13,0,,344,SiD_HaRtH
1521,1635968016.0,True,False,True,False,False,False,t5_2qugx,r/delhi,215054,Happy Diwali to those who celebrate,/r/delhi/comments/qm29gw/happy_diwali_to_those_who_celebrate/,0,0,0,24,0,,345,timfuzail
1522,1624692471.0,True,False,True,False,False,False,t5_2qugx,r/delhi,215054,Niceeeeeeeee,/r/delhi/comments/o8646q/niceeeeeeeee/,2,0,0,13,0,,344,kissmyass3000
1523,1605874793.0,True,False,False,False,False,False,t5_2qugx,r/delhi,215054,Delhi pays taxes and doesn’t get what it deserves in return. Delhi deserves better.,/r/delhi/comments/jxo1lr/delhi_pays_taxes_and_doesnt_get_what_it_deserves/,0,0,0,49,0,,347,aydenferguson
1524,1638873264.0,True,False,False,False,False,False,t5_2qugx,r/delhi,215054,So happy to see the AQI below 300. Thanks to the wind flow.,/r/delhi/comments/raw9dj/so_happy_to_see_the_aqi_below_300_thanks_to_the/,0,0,0,21,0,,340,ypavan95
1525,1616903099.0,True,False,False,False,False,False,t5_2qugx,r/delhi,215054,Vasant Kunj,/r/delhi/comments/mett9g/vasant_kunj/,0,0,0,36,1,,341,alexios28
1526,1627824823.0,True,False,False,False,False,False,t5_2qugx,r/delhi,215054,A beautiful sunset. Dwarka Sector-6,/r/delhi/comments/ovs7dh/a_beautiful_sunset_dwarka_sector6/,0,0,0,20,0,,340,hellonair
1527,1614755028.0,True,False,False,False,False,False,t5_2qugx,r/delhi,215054,"Afternoon, Janakpuri",/r/delhi/comments/lwnphe/afternoon_janakpuri/,1,0,0,27,0,,342,exactlyprateek
1528,1647160701.0,True,False,False,False,False,False,t5_2qugx,r/delhi,215054,The traffic light too gives up managing this Delhi traffic. Drop some unsaid rules of driving on Delhi roads!,/r/delhi/comments/td2mda/the_traffic_light_too_gives_up_managing_this/,1,0,0,121,0,,343,Damn-Am
1529,1636151373.0,True,False,False,False,False,False,t5_2qugx,r/delhi,215054,Seemed like a nice cinematic shot... turned out just ok,/r/delhi/comments/qnmbn3/seemed_like_a_nice_cinematic_shot_turned_out_just/,0,0,0,24,0,,339,notNoel
1530,1630484377.0,True,False,False,False,False,False,t5_2qugx,r/delhi,215054,Why? Proper action should be taken against her...,/r/delhi/comments/pfpii8/why_proper_action_should_be_taken_against_her/,0,0,0,61,1,,339,rb_kishore
1531,1622822784.0,True,False,False,False,False,False,t5_2qugx,r/delhi,215054,Me to Delhi: CAN YOU NORMAL JUST FOR ONCE,/r/delhi/comments/ns8okp/me_to_delhi_can_you_normal_just_for_once/,1,0,0,28,0,,339,first_name_harshit
1532,1643605020.0,True,False,True,False,False,False,t5_2qugx,r/delhi,215054,"Yeh bhi dilli, just a random gali in Vijay Enclave.",/r/delhi/comments/sgst4e/yeh_bhi_dilli_just_a_random_gali_in_vijay_enclave/,0,0,0,96,0,,338,shrippi
1533,1611033521.0,True,False,False,False,False,False,t5_2qugx,r/delhi,215054,A view of signature bridge from a cafe in MKT,/r/delhi/comments/l0czo5/a_view_of_signature_bridge_from_a_cafe_in_mkt/,1,0,0,28,0,,338,takemyshit7777
1534,1581932965.0,True,False,False,False,False,False,t5_2qugx,r/delhi,215054,"taking care of things, nothing to see here.",/r/delhi/comments/f56iey/taking_care_of_things_nothing_to_see_here/,0,0,0,36,0,,339,SKAr-FACE
1535,1619096664.0,True,False,False,False,False,False,t5_2qugx,r/delhi,215054,Ah shit here we go again,/r/delhi/comments/mw49ue/ah_shit_here_we_go_again/,0,0,0,4,0,,333,lucifersid
1536,1648443392.0,True,True,False,False,False,False,t5_2qugx,r/delhi,215054,Acc to you which is the lowest tier indian sweet and why is it petha ?,/r/delhi/comments/tq1ndp/acc_to_you_which_is_the_lowest_tier_indian_sweet/,0,0,0,298,0,,336,Ok_Swan_7760
1537,1645940540.0,True,False,False,False,False,False,t5_2qugx,r/delhi,215054,📍waste to wonder theme park,/r/delhi/comments/t2h4sn/waste_to_wonder_theme_park/,0,0,0,31,0,,329,zoltengren
1538,1621565601.0,True,False,False,False,False,False,t5_2qugx,r/delhi,215054,This breaks my heart,/r/delhi/comments/nhidci/this_breaks_my_heart/,0,0,0,35,0,,332,salikwaq
1539,1604293922.0,True,False,False,False,False,False,t5_2qugx,r/delhi,215054,Khan market,/r/delhi/comments/jmhmb4/khan_market/,0,0,0,14,0,,337,FluentInMemesDawg
1540,1595752664.0,True,False,False,False,False,False,t5_2qugx,r/delhi,215054,"""New"" Chandni Chowk",/r/delhi/comments/hy3hv1/new_chandni_chowk/,0,0,0,30,0,,336,gaurava99
1541,1640507490.0,True,False,False,False,False,False,t5_2qugx,r/delhi,215054,"Monkey Man aka Nakaposh/Kalabandar of Delhi : who all remember him, share your experiences or stories!",/r/delhi/comments/rosw2o/monkey_man_aka_nakaposhkalabandar_of_delhi_who/,0,0,0,85,0,,337,BangMinisterOp
1542,1615188390.0,True,False,False,False,False,False,t5_2qugx,r/delhi,215054,Only a Delhite can defy laws of physics,/r/delhi/comments/m0agzu/only_a_delhite_can_defy_laws_of_physics/,1,0,0,18,0,,328,theguywhosleep
1543,1650483175.0,True,False,False,False,False,False,t5_2qugx,r/delhi,215054,A glimpse of unauthorised colonies in Delhi as per DDA.,/r/delhi/comments/u84heh/a_glimpse_of_unauthorised_colonies_in_delhi_as/,0,0,0,130,0,,331,Dreadit10
1544,1650007873.0,True,False,False,False,False,False,t5_2qugx,r/delhi,215054,Last Night Delhi,/r/delhi/comments/u42nh9/last_night_delhi/,0,0,0,12,0,,329,EchoesEducation
1545,1625251951.0,True,False,False,False,False,False,t5_2qugx,r/delhi,215054,After the showers!,/r/delhi/comments/ocgnhc/after_the_showers/,0,0,0,31,0,,332,thebig_bong
1546,1621447516.0,True,False,False,False,False,False,t5_2qugx,r/delhi,215054,Beautiful,/r/delhi/comments/ngcp2b/beautiful/,1,0,0,11,0,,331,lubalubalub
1547,1646400215.0,True,False,False,False,False,False,t5_2qugx,r/delhi,215054,I see your Greater Noida pics and I raise you mine,/r/delhi/comments/t6iw06/i_see_your_greater_noida_pics_and_i_raise_you_mine/,2,0,0,34,0,,327,ahm_rimer
1548,1633060027.0,True,False,False,False,False,False,t5_2qugx,r/delhi,215054,Full front page let's goooooo!,/r/delhi/comments/pyzvqh/full_front_page_lets_goooooo/,0,0,0,150,0,,335,ReactionFamous3955
1549,1632571593.0,True,False,False,False,False,False,t5_2qugx,r/delhi,215054,Andar se toot chuka hu,/r/delhi/comments/pv5ifo/andar_se_toot_chuka_hu/,4,0,0,143,0,,330,muthhal_samosa
1550,1630993513.0,True,False,False,False,False,False,t5_2qugx,r/delhi,215054,And They say Delhi isn’t beautiful anymore!!,/r/delhi/comments/pjgx43/and_they_say_delhi_isnt_beautiful_anymore/,0,0,0,45,0,,332,K3Dii
1551,1649321657.0,True,False,False,False,False,False,t5_2qugx,r/delhi,215054,"Sundar, as it is.",/r/delhi/comments/ty8rhk/sundar_as_it_is/,0,0,0,10,0,,328,Ok-Till8836
1552,1641660337.0,True,False,False,False,False,False,t5_2qugx,r/delhi,215054,Delhi’s weather 🧘🏼,/r/delhi/comments/rz40np/delhis_weather/,1,0,0,67,0,,330,negidank
1553,1615365472.0,True,False,False,False,False,False,t5_2qugx,r/delhi,215054,"Adopted 6 of these from roadside, other two are roaming around.",/r/delhi/comments/m1t1k8/adopted_6_of_these_from_roadside_other_two_are/,9,0,0,23,0,,326,AlphaBetaThetaGreta
1554,1619853640.0,True,False,False,False,False,False,t5_2qugx,r/delhi,215054,"Only few private hospitals offering jabs for 18+, managed to get a slot somehow, wish me luck.",/r/delhi/comments/n2df8z/only_few_private_hospitals_offering_jabs_for_18/,1,0,0,80,0,,324,spacejury
1555,1619510449.0,True,True,False,False,False,False,t5_2qugx,r/delhi,215054,Please guys any help please,/r/delhi/comments/mzje02/please_guys_any_help_please/,1,0,0,75,1,,330,misbah69
1556,1597475817.0,True,False,False,False,False,False,t5_2qugx,r/delhi,215054,"Because we're posting pictures of DTC, here's a double decker DTC bus",/r/delhi/comments/ia33od/because_were_posting_pictures_of_dtc_heres_a/,0,0,0,34,0,,329,
1557,1649039194.0,True,False,False,False,False,False,t5_2qugx,r/delhi,215054,Took this pic at Dwarka Sector 12 Metro station at 6AM.,/r/delhi/comments/tvqv4w/took_this_pic_at_dwarka_sector_12_metro_station/,0,0,0,18,0,,323,rangoon54
1558,1626831957.0,True,False,True,False,False,False,t5_2qugx,r/delhi,215054,"The not so beautiful side of delhi. Sometimes, I wonder why the areas around railway tracks are so unclean in every city.",/r/delhi/comments/oog6dx/the_not_so_beautiful_side_of_delhi_sometimes_i/,0,0,0,39,1,,325,sam282000
1559,1637904179.0,True,False,False,False,False,False,t5_2qugx,r/delhi,215054,He’s saying hello to all of you🦮,/r/delhi/comments/r2foq5/hes_saying_hello_to_all_of_you/,1,0,0,15,0,,322,Explorer_sun
1560,1625376615.0,True,False,True,False,False,False,t5_2qugx,r/delhi,215054,Aftermath.,/r/delhi/comments/ode1tv/aftermath/,0,0,0,31,0,,326,shadysahil
1561,1650276759.0,True,False,False,False,False,False,t5_2qugx,r/delhi,215054,"Auto, Taxi Drivers Start 2-Day Strike Today Over Fuel Price Hike in New Delhi",/r/delhi/comments/u69onl/auto_taxi_drivers_start_2day_strike_today_over/,0,0,0,68,0,,325,EchoesEducation
1562,1641813248.0,True,False,False,False,False,False,t5_2qugx,r/delhi,215054,Ufff NDMC is a killjoy. Na kuttey Na Cricket!,/r/delhi/comments/s0hph4/ufff_ndmc_is_a_killjoy_na_kuttey_na_cricket/,1,0,0,81,0,,321,mrwolfie2u
1563,1635876679.0,True,False,False,False,False,False,t5_2qugx,r/delhi,215054,East Kidwai Nagar on Dhanteras,/r/delhi/comments/qladc3/east_kidwai_nagar_on_dhanteras/,0,0,0,33,0,,321,gauravgoru
1564,1596002200.0,True,False,False,False,False,False,t5_2qugx,r/delhi,215054,DELHI WEATHER IS UNPREDICTABLE!,/r/delhi/comments/hzvaib/delhi_weather_is_unpredictable/,0,0,0,17,0,,326,khuraafat
1565,1629384780.0,True,False,False,False,False,False,t5_2qugx,r/delhi,215054,Literally pulled over while driving to capture this sunset. Happy World Photography day to all the crazy photographers here.,/r/delhi/comments/p7gdbj/literally_pulled_over_while_driving_to_capture/,3,0,0,27,0,,318,sbred7
1566,1625489552.0,True,False,False,False,False,False,t5_2qugx,r/delhi,215054,Just a unique perspective.,/r/delhi/comments/oe6rmr/just_a_unique_perspective/,1,0,0,26,0,,326,ushir_302
1567,1645124082.0,True,False,False,False,False,False,t5_2qugx,r/delhi,215054,People always seem to appreciate metro pics so giving it a go here. It was taken after 12AM in pink line. Last Metro Home.,/r/delhi/comments/suwamc/people_always_seem_to_appreciate_metro_pics_so/,0,0,0,30,0,,326,gh0stking7
