,created_utc,is_crosspostable,is_self,is_video,locked,media_only,over_18,subreddit_id,subreddit_name_prefixed,subreddit_subscribers,title,permalink,total_awards_received,downs,gilded,num_comments,num_crossposts,num_reports,ups,author_name
2256,1598281379.0,True,False,True,False,False,False,t5_2s46r,r/UBreddit,15855,UB Access Pass Glitchless Mobile Speed Run NEW RECORD (22 SECONDS),/r/UBreddit/comments/ifqnly/ub_access_pass_glitchless_mobile_speed_run_new/,3,0,2,15,0,,201,blueberrybrown
2257,1551041400.0,True,False,False,False,False,False,t5_2s46r,r/UBreddit,15855,High winds have ripped off the roof of the UB Bookstore. @UBSpectrum has more videos and pictures on Twitter.,/r/UBreddit/comments/aucecc/high_winds_have_ripped_off_the_roof_of_the_ub/,0,0,0,30,1,,206,newsubspectrum
2258,1615329658.0,True,False,False,False,False,False,t5_2s46r,r/UBreddit,15855,"To the user that posted advice to eat Halo clementines, this is my second one today! They have some nice little boxes at Wegman’s for like $5.99",/r/UBreddit/comments/m1ifeu/to_the_user_that_posted_advice_to_eat_halo/,3,0,0,32,0,,201,Olga_foroga420
2259,1555963459.0,True,False,False,False,False,False,t5_2s46r,r/UBreddit,15855,Academic Spine nearing Sunset,/r/UBreddit/comments/bg6o6o/academic_spine_nearing_sunset/,0,0,0,12,0,,206,akosiiwayner1315
2260,1555520977.0,True,False,False,False,False,False,t5_2s46r,r/UBreddit,15855,"UB President Satish Tripathi announces the death of Sebastian Serafin-Bazan, the student victim of Friday’s possible hazing on South Campus",/r/UBreddit/comments/beabp7/ub_president_satish_tripathi_announces_the_death/,0,0,0,136,1,,200,newsubspectrum
2261,1641526206.0,True,False,False,False,False,False,t5_2s46r,r/UBreddit,15855,I made a goose 😁,/r/UBreddit/comments/rxxflo/i_made_a_goose/,3,0,0,19,0,,203,conundruumm
2262,1631048961.0,True,False,False,False,False,False,t5_2s46r,r/UBreddit,15855,Dumpster fire? Come on,/r/UBreddit/comments/pjw1e7/dumpster_fire_come_on/,0,0,0,25,0,,203,SkyeLight14
2263,1628535902.0,True,False,False,False,False,False,t5_2s46r,r/UBreddit,15855,You are being mean to the geese.,/r/UBreddit/comments/p1839f/you_are_being_mean_to_the_geese/,4,0,0,12,0,,201,stopette
2264,1605123106.0,True,False,False,False,False,False,t5_2s46r,r/UBreddit,15855,Bruh this entire semester is going downhill and all of them is a fucking prerequisite,/r/UBreddit/comments/jsew4v/bruh_this_entire_semester_is_going_downhill_and/,0,0,0,16,0,,202,purple_mist18
2265,1580442400.0,True,False,False,False,False,False,t5_2s46r,r/UBreddit,15855,Me after trying to cut through Capen for the first time this semester.,/r/UBreddit/comments/ewiaa7/me_after_trying_to_cut_through_capen_for_the/,0,0,0,5,0,,202,FuzzyWaffle52
2266,1576374611.0,True,False,False,False,False,False,t5_2s46r,r/UBreddit,15855,It’s never ending...,/r/UBreddit/comments/easqz4/its_never_ending/,0,0,0,5,0,,202,asbestis
2267,1565655802.0,True,False,False,False,False,False,t5_2s46r,r/UBreddit,15855,There's a new coat of paint on the crosswalk in front of student union! 🏳️‍🌈,/r/UBreddit/comments/cpl672/theres_a_new_coat_of_paint_on_the_crosswalk_in/,0,0,0,34,0,,201,PolymathBard
2268,1606596617.0,True,False,False,False,False,False,t5_2s46r,r/UBreddit,15855,Record breaking game by the bulls and Jarrett Patterson!,/r/UBreddit/comments/k2vdwy/record_breaking_game_by_the_bulls_and_jarrett/,2,0,0,21,0,,200,bills1648
2269,1605298956.0,True,False,False,False,False,False,t5_2s46r,r/UBreddit,15855,it never ends,/r/UBreddit/comments/jtnkpd/it_never_ends/,0,0,0,13,0,,203,Veylia
2270,1588721180.0,True,False,False,False,False,False,t5_2s46r,r/UBreddit,15855,Course Evals got me feeling like,/r/UBreddit/comments/ge8o2x/course_evals_got_me_feeling_like/,1,0,1,5,0,,203,UBJoa
2271,1587318712.0,True,False,False,False,False,False,t5_2s46r,r/UBreddit,15855,When you see all the memes about the physics department and you have no idea what is happening,/r/UBreddit/comments/g4c0mm/when_you_see_all_the_memes_about_the_physics/,0,0,0,17,0,,201,Faimilyman
2272,1587220681.0,True,False,False,False,False,False,t5_2s46r,r/UBreddit,15855,Happy Saturday everyone! After an hour of taking the PHY107 exam my lockdown browser crashed and I wasn’t able to finish the exam!,/r/UBreddit/comments/g3oi7l/happy_saturday_everyone_after_an_hour_of_taking/,0,0,0,71,0,,199,cameronracey
2273,1584056033.0,True,False,False,False,False,False,t5_2s46r,r/UBreddit,15855,True true,/r/UBreddit/comments/fhpzct/true_true/,0,0,0,2,0,,201,L_YTH
2274,1583757269.0,True,False,False,False,False,False,t5_2s46r,r/UBreddit,15855,WEEK 7!!! SPRING BREAK IS COMING UP SO LET'S PUT IN THE WORK THIS WEEK!! EVERYBODY GIVE IT UP FOR WEEK 7!!!,/r/UBreddit/comments/fftz30/week_7_spring_break_is_coming_up_so_lets_put_in/,0,0,0,11,0,,200,ranych
2275,1568652555.0,True,False,False,False,False,False,t5_2s46r,r/UBreddit,15855,WEEK 4!!! FUCK BOOMBOX GUY AND HIS ANNOYING ASS MUSIC!!! EVERYBODY GIVE IT UP FOR WEEK 4!!!!,/r/UBreddit/comments/d53dct/week_4_fuck_boombox_guy_and_his_annoying_ass/,0,0,0,10,0,,204,CyanideSandwich7
2276,1582508657.0,True,False,False,False,False,False,t5_2s46r,r/UBreddit,15855,Richmond and Red Jacket towers looking very colorful as per usual,/r/UBreddit/comments/f8jpxc/richmond_and_red_jacket_towers_looking_very/,0,0,0,14,0,,200,oceantiddy
2277,1576879760.0,True,False,False,False,False,False,t5_2s46r,r/UBreddit,15855,The UB Bulls have defeated the Charlotte 49ers by a score of 31-9 for their first bowl victory in program history at the Bahamas Bowl in Nassau today! Jaret Patterson finishes his outstanding season with a 173 rushing yard and 2 touchdown performance. Go Bulls!!!,/r/UBreddit/comments/edgvme/the_ub_bulls_have_defeated_the_charlotte_49ers_by/,0,0,0,7,0,,200,baseball1799
2278,1643654429.0,True,False,False,False,False,False,t5_2s46r,r/UBreddit,15855,Week 1! Give it up for week 1!,/r/UBreddit/comments/sh8jpk/week_1_give_it_up_for_week_1/,3,0,1,8,0,,198,Lambaline
2279,1585280461.0,True,False,False,False,False,False,t5_2s46r,r/UBreddit,15855,Prof really hit me with the “what’s a curve”,/r/UBreddit/comments/fppzij/prof_really_hit_me_with_the_whats_a_curve/,0,0,0,8,0,,199,Kliegz
2280,1638283339.0,True,False,False,False,False,False,t5_2s46r,r/UBreddit,15855,the winterberry trees outside knox !,/r/UBreddit/comments/r5oqbe/the_winterberry_trees_outside_knox/,0,0,0,16,0,,195,llbeanjamin
2281,1630296046.0,True,False,False,False,False,False,t5_2s46r,r/UBreddit,15855,GIVE IT UP FOR WEEK ONE!!! HOPE Y'ALL ENJOYED THE WEEKEND!!! LET'S START THIS SEMESTER STRONG!!!,/r/UBreddit/comments/peaja9/give_it_up_for_week_one_hope_yall_enjoyed_the/,5,0,0,4,0,,198,OatMatchaLatte
2282,1605282279.0,True,False,False,False,False,False,t5_2s46r,r/UBreddit,15855,Oh great it’s official 15 straight weeks of struggle in the Spring....,/r/UBreddit/comments/jthy8h/oh_great_its_official_15_straight_weeks_of/,1,0,0,56,0,,198,Noclue42AW
2283,1603379079.0,True,False,False,False,False,False,t5_2s46r,r/UBreddit,15855,Professor this is important please I do not want to fail it,/r/UBreddit/comments/jg1b55/professor_this_is_important_please_i_do_not_want/,0,0,0,11,0,,198,
2284,1594959629.0,True,False,False,False,False,False,t5_2s46r,r/UBreddit,15855,UB can't keep students from smoking cigarettes next to a playground full of toddlers.... And yet they're going to enforce a 100% mask policy....,/r/UBreddit/comments/hsp5zq/ub_cant_keep_students_from_smoking_cigarettes/,0,0,0,65,0,,198,360-survey-jerk
2285,1583377364.0,True,False,False,False,False,False,t5_2s46r,r/UBreddit,15855,Me watching the guy at Pistachio’s make my order in front of me,/r/UBreddit/comments/fdorqu/me_watching_the_guy_at_pistachios_make_my_order/,0,0,0,10,0,,196,Andres-Picado
2286,1648996041.0,True,False,False,False,False,False,t5_2s46r,r/UBreddit,15855,UB on r/place!,/r/UBreddit/comments/tvaha4/ub_on_rplace/,0,0,0,10,0,,196,ctam007
2287,1646909886.0,True,False,False,False,False,False,t5_2s46r,r/UBreddit,15855,Table For 2 at LaSalle Lake/Baird Point 2010,/r/UBreddit/comments/taw7aj/table_for_2_at_lasalle_lakebaird_point_2010/,0,0,0,11,0,,194,kashpny02
2288,1588176569.0,True,False,False,False,False,False,t5_2s46r,r/UBreddit,15855,Class of 2020. Picture was taking in 2016. 🎉🎉👩🏻‍🎓🧑🏻‍🎓👨🏻‍🎓,/r/UBreddit/comments/gaca0t/class_of_2020_picture_was_taking_in_2016/,0,0,0,14,0,,197,hawraaal
2289,1569769828.0,True,False,False,False,False,False,t5_2s46r,r/UBreddit,15855,🤔,/r/UBreddit/comments/dawd2q/_/,0,0,0,4,0,,195,
2290,1569284840.0,True,False,True,False,False,False,t5_2s46r,r/UBreddit,15855,They added a water fountain to Capen,/r/UBreddit/comments/d8figp/they_added_a_water_fountain_to_capen/,0,0,0,11,0,,198,matttech88
2291,1568329694.0,True,True,False,False,False,False,t5_2s46r,r/UBreddit,15855,An open letter to that one kid who blasts his giant speaker everywhere he goes:,/r/UBreddit/comments/d3g45e/an_open_letter_to_that_one_kid_who_blasts_his/,0,0,0,78,0,,196,notoriousmrtom
2292,1557678203.0,True,False,True,False,False,False,t5_2s46r,r/UBreddit,15855,New recruits learning to march (footage behind enemy lines),/r/UBreddit/comments/bnqrxf/new_recruits_learning_to_march_footage_behind/,0,0,0,12,0,,194,12jonboy12
2293,1637870462.0,True,False,True,False,False,False,t5_2s46r,r/UBreddit,15855,A Normal day in UB,/r/UBreddit/comments/r252qh/a_normal_day_in_ub/,3,0,0,6,0,,195,audaciousPert
2294,1608258118.0,True,False,False,False,False,False,t5_2s46r,r/UBreddit,15855,"Fall Semester, more like Fail Semester amirte?",/r/UBreddit/comments/kfc09i/fall_semester_more_like_fail_semester_amirte/,0,0,0,18,0,,196,_gvne
2295,1608054675.0,True,False,False,False,False,False,t5_2s46r,r/UBreddit,15855,I still don't see a reason why to wake up so damn early,/r/UBreddit/comments/kdqiun/i_still_dont_see_a_reason_why_to_wake_up_so_damn/,0,0,0,14,0,,192,_gvne
2296,1606441145.0,True,True,False,False,False,False,t5_2s46r,r/UBreddit,15855,For those who cannot be with their families now or are with their families who are toxic,/r/UBreddit/comments/k1rw2t/for_those_who_cannot_be_with_their_families_now/,4,0,1,4,0,,196,asdfjgkdll
2297,1588539421.0,True,False,False,False,False,False,t5_2s46r,r/UBreddit,15855,The truth :/,/r/UBreddit/comments/gcy2xt/the_truth/,0,0,0,26,0,,192,thoth8
2298,1576365117.0,True,False,False,False,False,False,t5_2s46r,r/UBreddit,15855,:),/r/UBreddit/comments/eaqwyv/_/,0,0,0,6,0,,196,aSunflowerPlant
2299,1576169025.0,True,True,False,False,False,False,t5_2s46r,r/UBreddit,15855,Tonight's Vigil,/r/UBreddit/comments/e9q06a/tonights_vigil/,1,0,0,9,0,,196,Ling_Keer
2300,1572288965.0,True,False,False,False,False,False,t5_2s46r,r/UBreddit,15855,WEEK 10!!! SPOOKTOBER 31st IS APPROACHING!!! TIME TO GET SPOOKY!!! EVERYBODY GIVE IT UP FOR WEEK 10!!!,/r/UBreddit/comments/dodcnm/week_10_spooktober_31st_is_approaching_time_to/,0,0,0,10,0,,193,CyanideSandwich7
2301,1569426864.0,True,False,False,False,False,False,t5_2s46r,r/UBreddit,15855,Leaf bug outside of the Student Union,/r/UBreddit/comments/d957wx/leaf_bug_outside_of_the_student_union/,0,0,0,8,0,,197,Scuffedmountain
2302,1649862808.0,True,False,False,False,False,False,t5_2s46r,r/UBreddit,15855,why no work ¿,/r/UBreddit/comments/u2skp4/why_no_work/,1,0,0,7,0,,195,skippy_dinglechalk91
2303,1647458841.0,True,False,False,False,False,False,t5_2s46r,r/UBreddit,15855,This sub in a nutshell,/r/UBreddit/comments/tfqr9y/this_sub_in_a_nutshell/,0,0,0,12,0,,193,YaBoiOheb
2304,1630937565.0,True,False,False,False,False,False,t5_2s46r,r/UBreddit,15855,WEEK 2!!!! HAPPY LABOR DAY!!! ENJOY THE ONLY DAY OFF WE’LL GET TIL THANKSGIVING!!! EVERYBODY GIVE IT UP FOR WEEK 2!!!,/r/UBreddit/comments/pj06pc/week_2_happy_labor_day_enjoy_the_only_day_off/,3,0,0,9,0,,194,CyanideSandwich7
2305,1590597944.0,True,False,False,False,False,False,t5_2s46r,r/UBreddit,15855,I’m so happy!! I know this isn’t a huge deal but I really didn’t know if I could do it (no hate please this is a big accomplishment for me) Officially not an intended major anymore!! Engineering here I come!!,/r/UBreddit/comments/grn93c/im_so_happy_i_know_this_isnt_a_huge_deal_but_i/,0,0,0,22,0,,198,dejj123
2306,1590440293.0,True,False,False,False,False,False,t5_2s46r,r/UBreddit,15855,"I know this is bragging, but none of my friends are CS and I wanted to share: I got an A in CSE250 & CSE220 this semester!",/r/UBreddit/comments/gqj7d3/i_know_this_is_bragging_but_none_of_my_friends/,1,0,0,44,0,,190,UB_cse
2307,1581820641.0,True,False,False,False,False,False,t5_2s46r,r/UBreddit,15855,3 legends > 2 Boomboxes,/r/UBreddit/comments/f4k6hm/3_legends_2_boomboxes/,0,0,0,1,0,,197,Andres-Picado
2308,1580218976.0,True,False,False,False,False,False,t5_2s46r,r/UBreddit,15855,Every finals week ever,/r/UBreddit/comments/ev5rez/every_finals_week_ever/,0,0,0,2,0,,194,Uber_Speng
2309,1575207327.0,True,False,False,False,False,False,t5_2s46r,r/UBreddit,15855,Thanks for the half week break and scheduling shit on top of it.,/r/UBreddit/comments/e4hi98/thanks_for_the_half_week_break_and_scheduling/,0,0,0,7,0,,194,nolaz010
2310,1644255636.0,True,False,False,False,False,False,t5_2s46r,r/UBreddit,15855,Please...just leave...,/r/UBreddit/comments/smvyq7/pleasejust_leave/,0,0,0,15,0,,193,skippy_dinglechalk91
2311,1599169734.0,True,False,False,False,False,False,t5_2s46r,r/UBreddit,15855,Day 4 of drawing a single COVID-19 virus every day until campus closes,/r/UBreddit/comments/im314n/day_4_of_drawing_a_single_covid19_virus_every_day/,2,0,0,8,0,,193,serverfires
2312,1587224354.0,True,False,False,False,False,False,t5_2s46r,r/UBreddit,15855,unbelievable,/r/UBreddit/comments/g3phai/unbelievable/,0,0,0,3,0,,195,Veylia
2313,1583272169.0,True,True,False,False,False,False,t5_2s46r,r/UBreddit,15855,There’s a special place in hell for people who stop to talk on the staircase between Berts and NSC,/r/UBreddit/comments/fd267r/theres_a_special_place_in_hell_for_people_who/,0,0,0,23,0,,194,hungdaddy914
2314,1580516213.0,True,False,False,False,False,False,t5_2s46r,r/UBreddit,15855,@ub WiFi,/r/UBreddit/comments/ewxotq/ub_wifi/,0,0,0,2,0,,196,rileymer
2315,1576210509.0,True,False,False,False,False,False,t5_2s46r,r/UBreddit,15855,I saw that lots of people on Reddit said that the email the president sent out was copied and pasted from the hazing incident. So I did a side by side and underlined everything that was the exact same with minor switching of words.,/r/UBreddit/comments/e9yydl/i_saw_that_lots_of_people_on_reddit_said_that_the/,2,0,1,30,0,,194,tcheung88
2316,1649819617.0,True,False,False,False,False,False,t5_2s46r,r/UBreddit,15855,Today’s one big mind fuck.,/r/UBreddit/comments/u2gqti/todays_one_big_mind_fuck/,0,0,0,7,0,,192,TheUBMemeDaddy
2317,1635013212.0,True,False,False,False,False,False,t5_2s46r,r/UBreddit,15855,Another one,/r/UBreddit/comments/qeabv4/another_one/,0,0,0,11,0,,192,_PineappleBoss_
2318,1633462785.0,True,False,False,False,False,False,t5_2s46r,r/UBreddit,15855,Wow people really just park anywhere. Hope it gets booted.,/r/UBreddit/comments/q23vaf/wow_people_really_just_park_anywhere_hope_it_gets/,2,0,0,10,0,,192,
2319,1581531606.0,True,False,False,False,False,False,t5_2s46r,r/UBreddit,15855,University at Buffalo (circa 2020),/r/UBreddit/comments/f2vifr/university_at_buffalo_circa_2020/,0,0,0,1,0,,194,whosenameisjeff
2320,1567502170.0,True,False,False,False,False,False,t5_2s46r,r/UBreddit,15855,College life hacks 101,/r/UBreddit/comments/cz2enm/college_life_hacks_101/,1,0,0,15,0,,190,LetLemon
2321,1649895651.0,True,False,False,False,False,False,t5_2s46r,r/UBreddit,15855,"Update: Changed up my look and I’ve officially come to terms with my election loss. Off to class, new outlook on life, nothing can ruin this day. #gobulls",/r/UBreddit/comments/u34ie9/update_changed_up_my_look_and_ive_officially_come/,2,0,0,14,0,,191,beepbeepnatecottom
2322,1639677694.0,True,False,False,False,False,False,t5_2s46r,r/UBreddit,15855,Me when I finished finals and then heading to the movies afterwards.,/r/UBreddit/comments/rhw9dl/me_when_i_finished_finals_and_then_heading_to_the/,0,0,0,4,0,,191,UBSpiderMan
2323,1635774619.0,True,True,False,False,False,False,t5_2s46r,r/UBreddit,15855,See the salaries of everyone who works at UB,/r/UBreddit/comments/qkeevi/see_the_salaries_of_everyone_who_works_at_ub/,2,0,0,56,0,,191,
2324,1633831683.0,True,False,False,False,False,False,t5_2s46r,r/UBreddit,15855,"""University at Buffalo"" according to AI image generator",/r/UBreddit/comments/q4z136/university_at_buffalo_according_to_ai_image/,0,0,0,8,0,,192,FortyCave
2325,1599001329.0,True,False,False,False,False,False,t5_2s46r,r/UBreddit,15855,Day 2 of drawing a single COVID-19 virus every day until campus closes,/r/UBreddit/comments/ikv1no/day_2_of_drawing_a_single_covid19_virus_every_day/,0,0,0,8,0,,193,serverfires
2326,1598701441.0,True,False,True,False,False,False,t5_2s46r,r/UBreddit,15855,Projecting cars on the outside Griener wall so people waiting to go to parties get distracted,/r/UBreddit/comments/iir1jh/projecting_cars_on_the_outside_griener_wall_so/,3,0,0,10,0,,192,Gruskin
2327,1587968060.0,True,False,True,False,False,False,t5_2s46r,r/UBreddit,15855,Time-lapse from my window in Richmond back in 2016,/r/UBreddit/comments/g8v104/timelapse_from_my_window_in_richmond_back_in_2016/,0,0,0,10,0,,192,thenativetiger
2328,1581690489.0,True,False,False,False,False,False,t5_2s46r,r/UBreddit,15855,power i have,/r/UBreddit/comments/f3sx1z/power_i_have/,0,0,0,0,0,,192,sofapotata
2329,1575406762.0,True,False,False,False,False,False,t5_2s46r,r/UBreddit,15855,"Repeat after me: You put the desks there, not the students.",/r/UBreddit/comments/e5nji2/repeat_after_me_you_put_the_desks_there_not_the/,1,0,1,24,0,,195,TheUBMemeDaddy
2330,1583436658.0,True,True,False,False,False,False,t5_2s46r,r/UBreddit,15855,To the edgy veggie employees who draw little faces on the salad containers:,/r/UBreddit/comments/fe0kxm/to_the_edgy_veggie_employees_who_draw_little/,0,0,0,10,0,,189,MacAndYeet144
2331,1580320713.0,True,False,False,False,False,False,t5_2s46r,r/UBreddit,15855,syllabus.docx syllabus(1).docx syllabus(2)(1).docx syllabus(10)(2).docx,/r/UBreddit/comments/evqex7/syllabusdocx_syllabus1docx_syllabus21docx/,0,0,0,9,0,,188,
2332,1549717680.0,True,False,False,False,False,False,t5_2s46r,r/UBreddit,15855,This is excellent 😂,/r/UBreddit/comments/aos6pr/this_is_excellent/,0,0,0,7,0,,190,
2333,1633727407.0,True,False,False,False,False,False,t5_2s46r,r/UBreddit,15855,UB is in dire need of a paint job 🤧,/r/UBreddit/comments/q46x7j/ub_is_in_dire_need_of_a_paint_job/,0,0,0,23,0,,191,OfficialNuttyNutella
2334,1631039409.0,True,False,False,False,False,False,t5_2s46r,r/UBreddit,15855,Truth hurts,/r/UBreddit/comments/pjswls/truth_hurts/,3,0,0,49,0,,190,diIdo__swaggins
2335,1620350425.0,True,False,False,False,False,False,t5_2s46r,r/UBreddit,15855,"Rip Yahoo Answers, you're the only reason I ever got full credit on my physics homework 🙏",/r/UBreddit/comments/n6myly/rip_yahoo_answers_youre_the_only_reason_i_ever/,1,0,0,14,0,,187,kalechip_2022
2336,1552657063.0,True,False,False,False,False,False,t5_2s46r,r/UBreddit,15855,Approaching Clemens on an already windy day like,/r/UBreddit/comments/b1f295/approaching_clemens_on_an_already_windy_day_like/,0,0,0,3,0,,189,Shannonraczka
2337,1647016946.0,True,False,False,False,False,False,t5_2s46r,r/UBreddit,15855,Relatable,/r/UBreddit/comments/tbu5ze/relatable/,0,0,0,9,0,,188,gursimratdotcom
2338,1618260333.0,True,False,False,False,False,False,t5_2s46r,r/UBreddit,15855,When I get the action required message every night,/r/UBreddit/comments/mpmyej/when_i_get_the_action_required_message_every_night/,0,0,0,10,0,,189,Dr_Helpless
2339,1616519499.0,True,False,False,False,False,False,t5_2s46r,r/UBreddit,15855,Please UB...its 70°...TURN OFF THE HEATER I CAN'T TAKE IT ANYMORE,/r/UBreddit/comments/mbjjio/please_ubits_70turn_off_the_heater_i_cant_take_it/,0,0,0,6,0,,187,_gvne
2340,1599494928.0,True,False,False,False,False,False,t5_2s46r,r/UBreddit,15855,Okay but did they complete their daily health check?,/r/UBreddit/comments/ioa95c/okay_but_did_they_complete_their_daily_health/,0,0,0,6,0,,191,rileymer
2341,1587486740.0,True,False,False,False,False,False,t5_2s46r,r/UBreddit,15855,This virus has shown us which professors are actually smart,/r/UBreddit/comments/g5ihhb/this_virus_has_shown_us_which_professors_are/,0,0,0,19,0,,189,MAE315MAE316
2342,1575324592.0,True,False,False,False,False,False,t5_2s46r,r/UBreddit,15855,"WEEK 15!!! LAST WEEK OF CLASSES WITH FINALS COMING UP SOON, GOOD LUCK!!! EVERYBODY GIVE IT UP FOR WEEK 15!!!",/r/UBreddit/comments/e56h9t/week_15_last_week_of_classes_with_finals_coming/,0,0,0,8,0,,186,CyanideSandwich7
2343,1570883423.0,True,False,False,False,False,False,t5_2s46r,r/UBreddit,15855,IFKYK,/r/UBreddit/comments/dguj6q/ifkyk/,0,0,0,8,0,,189,JJC_31
2344,1614537244.0,True,False,False,False,False,False,t5_2s46r,r/UBreddit,15855,Please stay safe. Keep your pools negative!,/r/UBreddit/comments/lumw9l/please_stay_safe_keep_your_pools_negative/,3,0,0,9,0,,186,
2345,1607205161.0,True,True,False,False,False,False,t5_2s46r,r/UBreddit,15855,"Dunno who needs to hear this, but...",/r/UBreddit/comments/k7gl4y/dunno_who_needs_to_hear_this_but/,10,0,0,16,0,,188,continuingcontinued
2346,1600440879.0,True,False,False,False,False,False,t5_2s46r,r/UBreddit,15855,Geese galore,/r/UBreddit/comments/iv7kl2/geese_galore/,0,0,0,11,0,,189,theblitz2011
2347,1596817650.0,True,True,False,False,False,False,t5_2s46r,r/UBreddit,15855,Don’t be an idiot this semester,/r/UBreddit/comments/i5gxa2/dont_be_an_idiot_this_semester/,0,0,0,60,0,,187,astern618
2348,1556117129.0,True,False,False,False,False,False,t5_2s46r,r/UBreddit,15855,"made this a while back, hopefully you'll get a kick out of it",/r/UBreddit/comments/bgvh1x/made_this_a_while_back_hopefully_youll_get_a_kick/,0,0,0,8,0,,189,wolozx
2349,1535475913.0,True,False,False,False,False,False,t5_2s46r,r/UBreddit,15855,The status of the WiFi the past few days,/r/UBreddit/comments/9b0phh/the_status_of_the_wifi_the_past_few_days/,0,0,0,4,0,,188,redhood56
2350,1613219723.0,True,False,False,False,False,False,t5_2s46r,r/UBreddit,15855,*Starts coughing*,/r/UBreddit/comments/lizs0f/starts_coughing/,4,0,0,12,0,,188,vinnlo
2351,1594951052.0,True,False,False,False,False,False,t5_2s46r,r/UBreddit,15855,:/,/r/UBreddit/comments/hsn4x2/_/,0,0,0,20,0,,186,thoth8
2352,1569712953.0,True,False,False,False,False,False,t5_2s46r,r/UBreddit,15855,davis during sunset,/r/UBreddit/comments/dang6m/davis_during_sunset/,0,0,0,5,0,,184,IntimidatingRice
2353,1568045161.0,True,False,False,False,False,False,t5_2s46r,r/UBreddit,15855,WEEK 3!!! EVERYBODY GIVE IT UP FOR WEEK 3!!! HOW TF IS IT WEEK 3 ALREADY?,/r/UBreddit/comments/d1swr6/week_3_everybody_give_it_up_for_week_3_how_tf_is/,0,0,0,21,0,,186,CyanideSandwich7
2354,1612297165.0,True,False,False,False,False,False,t5_2s46r,r/UBreddit,15855,Gonna be a rough semester boys,/r/UBreddit/comments/lb5c1i/gonna_be_a_rough_semester_boys/,0,0,0,7,0,,185,malevolentSloth
2355,1609042605.0,True,False,False,False,False,False,t5_2s46r,r/UBreddit,15855,"Robert F Kennedy speaking in front of Squire Hall on South Campus October 3, 1964!",/r/UBreddit/comments/kkwyn9/robert_f_kennedy_speaking_in_front_of_squire_hall/,0,0,0,1,0,,186,DrHerb98
2356,1601059732.0,True,False,False,False,False,False,t5_2s46r,r/UBreddit,15855,Me walking off the elevator on the fifth floor of Lockwood,/r/UBreddit/comments/izpe0f/me_walking_off_the_elevator_on_the_fifth_floor_of/,0,0,0,4,0,,183,disambition
2357,1599764478.0,True,False,False,False,False,False,t5_2s46r,r/UBreddit,15855,They used the Trap card,/r/UBreddit/comments/iq9tf8/they_used_the_trap_card/,0,0,0,3,0,,187,th3totalpackage
2358,1599603676.0,True,False,False,False,False,False,t5_2s46r,r/UBreddit,15855,me irl,/r/UBreddit/comments/ip3jxu/me_irl/,0,0,0,7,0,,184,JYFanboy
2359,1589915676.0,True,False,False,False,False,False,t5_2s46r,r/UBreddit,15855,Hope you all did well. Don't worry! Suckin’ at something is the first step to being sorta good at something.,/r/UBreddit/comments/gmv50h/hope_you_all_did_well_dont_worry_suckin_at/,0,0,0,3,0,,182,
2360,1580393295.0,True,False,False,False,False,False,t5_2s46r,r/UBreddit,15855,I wish all of you the best of luck this semester.,/r/UBreddit/comments/ew5ycj/i_wish_all_of_you_the_best_of_luck_this_semester/,0,0,0,29,0,,183,PENGUIN_WITH_BAZOOKA
2361,1575580257.0,True,False,False,False,False,False,t5_2s46r,r/UBreddit,15855,Mood,/r/UBreddit/comments/e6np9c/mood/,0,0,0,6,0,,188,yuyop
2362,1519987105.0,True,True,False,False,False,False,t5_2s46r,r/UBreddit,15855,SNOW DAY UPVOTE PARTY,/r/UBreddit/comments/81dcyg/snow_day_upvote_party/,0,0,0,10,0,,182,lesubreddit
2363,1640450559.0,True,False,False,False,False,False,t5_2s46r,r/UBreddit,15855,"Happy Holidays, UB! Hope you guys have a nice weekend and an even better winter break!",/r/UBreddit/comments/rocx4b/happy_holidays_ub_hope_you_guys_have_a_nice/,1,0,0,3,0,,184,UBSpiderMan
2364,1602621239.0,True,False,False,False,False,False,t5_2s46r,r/UBreddit,15855,5th floor problems require 5th floor solutions,/r/UBreddit/comments/jalu07/5th_floor_problems_require_5th_floor_solutions/,0,0,0,6,0,,183,dlivats19
2365,1599920968.0,True,False,False,False,False,False,t5_2s46r,r/UBreddit,15855,Almost done with the UB Covid memes I swear,/r/UBreddit/comments/irdkjx/almost_done_with_the_ub_covid_memes_i_swear/,1,0,0,6,0,,183,halonoob117
2366,1588638568.0,True,False,False,False,False,False,t5_2s46r,r/UBreddit,15855,who woulda thought 50 DAYS would FLY by like that? QUARANTINE BOREDOM V3!!! good luck with finals...,/r/UBreddit/comments/gdnmpu/who_woulda_thought_50_days_would_fly_by_like_that/,0,0,0,4,0,,183,shuakowsky
2367,1586062974.0,True,False,False,False,False,False,t5_2s46r,r/UBreddit,15855,"If you’re missing UB, here’s a pic of the path to Greiner",/r/UBreddit/comments/fv8aoq/if_youre_missing_ub_heres_a_pic_of_the_path_to/,1,0,0,17,0,,186,Shadowsam65
